date,tweet
2020-02-22,Getting there was super hard. Very proud of Tesla team!
2020-02-22,Model 3 achieves 350 mile actual range vs 310 EPA sticker in Consumer Reports testing
2020-02-22,"Yes, will also show real-time changes to max acceleration, braking, cornering, speed on gradient & range, latter factoring in route elevation changes & cargo or tow mass & drag impact"
2020-02-22,It’s slightly better
2020-02-22,Definitely worth trying imo
2020-02-21,"Btw, in some prior tweets I’d said production Cybertruck would be ~80” wide (vs ~84” body width at unveil). This is slightly too small. Will be closer to 82”, but come standard with upper laser blade lights."
2020-02-21,Active ride height & active damping are game-changing for a truck or any car with a high max/min weight ratio
2020-02-21,Science has gone too far
2020-02-21, 
2020-02-20,F9 iteration slowed down as payloads became too important to risk. Little change is expected going forward with F9/FH or Dragon. Starship production & thus iterative improvement will be much faster than Falcon. Driving hard for fully reusable orbital flight this year!
2020-02-20,"It’s mostly to balance the ship during entry. After delivering satellites, the front is light & back is heavy due to engines & landing legs."
2020-02-20,"Sorry, meant to say LOX header tank in tip of nose. CH4 main tank is above LOX main."
2020-02-20,LOX
2020-02-20,These problems are fundamentally intertwined. Building many rockets allows for successive approximation. Progress in any given technology is simply #of iterations * progress between iterations.
2020-02-20,Hardest problem by far is building the production system of something this big. 2nd hardest is achieving full & rapid reuse with payload to orbit of ~2%.
2020-02-20,Probably
2020-02-20,Attach wheels to the landing legs & tow Starship to the launch pad
2020-02-20,I rate it two Bugblatter Beasts of Traal up!
2020-02-20,"High bay for stacking Starship engine bay, propellant tanks & fairing (fka nosecone) sections is almost done!"
2020-02-20,"The whole nose tip has to have heat shielding for atmospheric entry at Mach 25+ anyway, so is effectively already insulated well in orbit"
2020-02-20,"There will be a common area in the forward section with a big window like this. It will be a lot heavier than steel, but not dangerous. Consider astronauts on the moon with a very thin windowed helmet. They were fine."
2020-02-20,"Header tanks are only ~2% of main tank volume, so not a big deal. Pressurized volume is still ~1000 cubic meters."
2020-02-20,"O2 header tank is tip of nosecone, CH4 header is in the main CH4 tank"
2020-02-20,In the order that they were written
2020-02-20,Worth reading Asimov’s Foundation https://en.m.wikipedia.org/wiki/Foundation_series
2020-02-19,"SN 2+ will have better fit & weld quality. Later serial numbers will use bigger stampings, so much less weld length."
2020-02-19,The Persuader hammer will fix SN1
2020-02-19,Rocket nosecone production in Texas
2020-02-19,
2020-02-19,Yes
2020-02-19,Glad you’re all ok! 
2020-02-18,Tim Curry ftw
2020-02-18, makeup
2020-02-18,"Unfortunately, I must agree that these are reasonable concerns"
2020-02-18,"True, that was pretty impressive"
2020-02-18,My conversations with Gates have been underwhelming tbh
2020-02-17,Both
2020-02-17,"All orgs developing advanced AI should be regulated, including Tesla"
2020-02-17,I have no control & only very limited insight into OpenAI. Confidence in Dario for safety is not high.
2020-02-17,OpenAI should be more open imo
2020-02-16,"Initially, yes, but then will make sense to localize closer to customers. Pretty much same plan as vehicles."
2020-02-16,Looking forward to international expansion later this year 
2020-02-16,"Tesla is ramping up Solar Roof installation across the USA! Training will be provided, so no prior experience needed. Apply at"
2020-02-15,Direct links aren’t needed to offer service. Starlink will initially bounce signals off ground/ocean relays to get from to .
2020-02-15, albedo will drop significantly on almost every successive launch
2020-02-15,Haha
2020-02-15,"Sorry, probably going to be a lot of rocket pics from @archillect "
2020-02-15,X will also improve by a similar amount
2020-02-15,"Depends on when car was built, as there are many small hardware improvements, so most will be somewhere in between 373 & 390"
2020-02-15,"Regulations require calling it something else, so we added +"
2020-02-15,"There’s a tough performance vs range tradeoff. Plaid has absurd performance, while holding range roughly constant."
2020-02-15,Maybe possible with improved wheels/tires (which would be available to all previously made cars)
2020-02-15,All S/X cars made in recent months have actually been above stated EPA range. Will be unlocked soon for free via software update.
2020-02-15,Tesla Model S estimated EPA range is now above 390 miles or ~630 km
2020-02-15,Run a physics sim long enough & you’ll get intelligence
2020-02-15,a=F/m is the most fun
2020-02-15,Frame rate Δt≥ℏ2/ΔE
2020-02-15,The resolution of reality
2020-02-14,Reminded me of The Lady of Shalott by Waterhouse
2020-02-14,Haha
2020-02-14,unNERVing
2020-02-14,"The joints will have shielding, but it’s hard to ensure a good seal. Transpiration cooling (or simply higher pressure cold gas flow) would purge the area behind the hot gas seal."
2020-02-14,Might be used around flap joints
2020-02-14,Will take action
2020-02-14,Only the heart senses beauty
2020-02-14,Shielding is only needed for orbital speeds
2020-02-13, be still my beating heart 
2020-02-13,"Unfortunately, Starship unlikely to survive LEO entry intact without shielding on windward side, but none required on leeward. Even windward shielding is very light."
2020-02-12, 
2020-02-12,Whoop whoop!!
2020-02-12,Thanks Mom!!! @mayemusk
2020-02-12,This does seem high
2020-02-12,And some vitamin k too
2020-02-12,Ok u can have a little emerald 
2020-02-10,This is incorrect. No air suspension planned for 3/Y. Only S/X & Cybertruck have/will have air suspension.
2020-02-10,Æsthetics
2020-02-10,The degree to which SolarGlass will positively effect the esthetics & energy sustainability of neighborhoods throughout the world is not yet well appreciated. This is a very important product.
2020-02-10,"Tesla April company talk will be from our Giga New York factory, where we make SolarGlass & several other products. Will also offer customer & media tours."
2020-02-10,Should preface this saying that feedback from early Tesla Solar roof owners has been v positive. It’s stunning vs a regular roof in person imo. Photos don’t do it justice.
2020-02-10,"Its integrated roof & solar, so should be light enough for almost any home"
2020-02-10,Coming hopefully later this year
2020-02-10,"I think will still be better than a normal roof, but adding a heating grid to automatically remove ice & snow sounds like a good option. We have that already on car windows!"
2020-02-10,"No problem. Snow and ice tend to slide off the Tesla SolarGlass due to lower surface roughness, so accumulates less than a normal roof. Even so, it’s very strong and can be walked on without breaking the glass tiles."
2020-02-10,Sounds should note that it gets less shiny automatically due to dust & weathering. This pic is brand new.
2020-02-10,Ok
2020-02-10,Sounds like we should open a Tesla Center there!
2020-02-10,Please let us know what improvements we can make to any aspect of Tesla SolarGlass roof! Critical feedback is much appreciated.
2020-02-10,"Probably 6 months or so. 301 is certainly fine for orbit, but SpaceX 30X will be better."
2020-02-10,Midsection of Starship propellant tanks
2020-02-10,"Yes, but we want to focus on textured black first, then move into Earth tones & convolutions"
2020-02-10,Your comment above: “Who in their right mind would buy an ICE after 2025 knowing its residual value will be zilch? Legacy auto: go EV or go BUST!” is super important for car buyers. Residual values for gas/diesel cars will plummet in coming years.
2020-02-10,Haha
2020-02-10,Foundation by Asimov
2020-02-10,"Mars is to Earth, as Terminus was to Trantor"
2020-02-10,Europe & China timing will be announced soon
2020-02-09,Many Bay Area installations are ongoing now
2020-02-09,"Hard to believe that is high efficiency solar power seamlessly integrated into beautiful roof tiles. Great work by SolarGlass engineering, Giga NY factory & Tesla installation teams!"
2020-02-09,Order at https://www.tesla.com/solarroof
2020-02-09,"First two domes in frame are for SN2, third is SN1 thrust dome"
2020-02-09,Back in Boca
2020-02-08,Including hypothesizing that this statement is wrong haha
2020-02-08,True
2020-02-08,#DeleteFacebook It’s lame
2020-02-08,Ok
2020-02-08,My Mom wrote a book http://bit.ly/2KiWMGh
2020-02-08, 
2020-02-08,"feeling cute, might delete later"
2020-02-08,"Once upon a time, we were all just hydrogen in a vacuum"
2020-02-08,"Impressive, if uncurated. There aren’t many errors. Would be interesting to see how @OpenAI GPT would perform with same objective."
2020-02-08, cropping
2020-02-08,Haha true
2020-02-07,You’re welcome! Was a fun recruiting event. Great to see all the excitement about helping build Starships.
2020-02-07,"Unmodified water tower machines do not work well for orbital rockets, as mass efficiency is critical for the latter, but not the former. Hopper, for example, was made of 12.5mm steel vs 4mm for SN1 orbital design. Optimized skins will be <2mm in places across a 9000mm diameter."
2020-02-07,"No, they’re SN1. SN2 to follow shortly. Aiming to be a little better each time."
2020-02-07,"Yes, we’re tuning weld parameters to reduce puckering & building a heavy duty planisher to flatten & cold work the weld area"
2020-02-07,"That said, although substantial capital & engineering is required to achieve extreme precision, marginal production cost of the primary structure should actually be *less* than a water tower, because it’s built inside a factory in volume."
2020-02-07,"This isn’t quite correct. An orbital rocket needs precision that’s 3X to 4X better than a water tower, so super precise parts, fixtures & welding are needed. Suborbital is much more forgiving."
2020-02-07,"SpaceX started with a mariachi band party. Great vibes here in Boca Chica, Texas!"
2020-02-06,True
2020-02-06,Late night tweets … sigh
2020-02-06,We saw them a lot launching from Kwajalein in the early days of SpaceX
2020-02-06,New emoji! Last one comes with free phone hack.
2020-02-06,Great shot
2020-02-06,"Anything that doesn’t result in a smudgy image on lens cover glass. If you get a two part hydrophobic coating, probably better just to use first part."
2020-02-06,It begins …
2020-02-06,“The Nutcracker” is tho
2020-02-06, 
2020-02-06,Haha
2020-02-06, 
2020-02-06,"What if there was an AI programmed to want to pick as many strawberries as possible, and so it cultivated nothing but strawberries on all of Earth’s land? Then it would be Strawberry Fields Forever!"
2020-02-06,Nice
2020-02-06,"Fine, but that was an easy one"
2020-02-06,New fins
2020-02-06,Rococo basilisk
2020-02-06,REALiTi made while u wait
2020-02-06,http://Etymology.com
2020-02-06,Making progress
2020-02-06,"All things in moderation, especially etymology"
2020-02-06,Essentially all quotes can be ascribed to Churchill
2020-02-06,"No matter how many times u get hangry, you always think ur anger is real — Plato"
2020-02-06,Guess he’s not left-handed
2020-02-06, 
2020-02-06,Tiny robots with lasers
2020-02-05,Starlink will be great for any sparsely populated areas with expensive or little to no connectivity!
2020-02-05, 
2020-02-05,Putting that on my LinkedIn for sure
2020-02-05,8th hottest song on Soundcloud!! https://m.soundcloud.com/user-209448905/dont-doubt-ur-vibe
2020-02-05,Please send your resume to BuildStarship@spacex.com if you’re coming to the Starship career day in Boca Chica tomorrow
2020-02-05,Starship Concerto in Zero G
2020-02-05,Yes
2020-02-05,Yes
2020-02-05,Giga Texas?
2020-02-05,Uh oh
2020-02-04,Have you tried a hydrophobic spray?
2020-02-04,"This is mainly for staffing up 4 production shifts for 24/7 operations, but engineers, supervisors & support personnel are certainly needed too. A super hardcore work ethic, talent for building things, common sense & trustworthiness are required, the rest we can train."
2020-02-04,"Starship career day at the Stargate building (Boca Chica Blvd, TX) this Thursday from 3pm to 9pm!"
2020-02-04,Going max hardcore on design/production Starship here in Boca. It’s awesome! Feels a bit like a Mars simulator.
2020-02-03,Definitely!
2020-02-03,Yes
2020-02-03, 
2020-02-03,"First, we need to make it super safe & easy to use, then determine greatest utility vs risk. From initially working to volume production & implantation is a long road. As with vehicle safety, it will be much harder to pass our internal standards than minimum regulatory standards."
2020-02-03,"Ok sure Btw, we recruit great engineers from almost anywhere in the world, so this shouldn’t be thought of as USA only. Also, work location can be Bay Area (preferred), but Austin (many of our chip designers are there) or potentially any Tesla Gigafactory."
2020-02-03,"Nothing medically dangerous, but 5g is getting a bit too greedy with their spectrum land grab"
2020-02-03,"Intuitively, that should be straightforward to address, but there could be complexities I’m unaware of"
2020-02-03,"True, it has general applications beyond fast, high precision micro-electrode insertion that automatically avoids the vasculature"
2020-02-03,"It will ultimately be used to make up for entire lost sections of the brain due to stroke/accident/congenital. Don’t want to get too excited, but the potential is truly transformational for restoring brain & motor functions. There is no other way to do it imo."
2020-02-03,Wait until you see the next version vs what was presented last year. It’s *awesome*.
2020-02-03,Probably this summer
2020-02-03,"Yeah, it looks like a medieval torture device, but is nonetheless currently used in many human studies! Not hard to be way better."
2020-02-03,PyTorch is the most frequently used external tool set/library
2020-02-03,"Our NN is initially in Python for rapid iteration, then converted to C++/C/raw metal driver code for speed (important!). Also, tons of C++/C engineers needed for vehicle control & entire rest of car. Educational background is irrelevant, but all must pass hardcore coding test."
2020-02-03,"The profound impact of high bandwidth, high precision neural interfaces is underappreciated. Neuralink may have this in a human as soon as this year. Just needs to be unequivocally better than Utah Array, which is already in some humans & has severe drawbacks."
2020-02-03,Sorry!
2020-02-02,A PhD is definitely not required. All that matters is a deep understanding of AI & ability to implement NNs in a way that is actually useful (latter point is what’s truly hard). Don’t care if you even graduated high school.
2020-02-02,"Not needed, but will be very useful on Mars due to light speed latency"
2020-02-02,Tesla will hold a super fun AI party/hackathon at my house with the Tesla AI/autopilot team in about four weeks. Invitations going out soon.
2020-02-02,"We are (obviously) also looking for world-class chip designers to join our team, based in both Palo Alto & Austin"
2020-02-02,"Dojo, our training supercomputer, will be able to process vast amounts of video training data & efficiently run hypersparce arrays with a vast number of parameters, plenty of memory & ultra-high bandwidth between cores. More on this later."
2020-02-02,"Our custom 144 TOPS in-vehicle inference computer, where almost every TOP is useable & optimized for NN, far exceeds anything else in volume production, giving you the hardware you need to run sophisticated nets"
2020-02-02,"Tesla will soon have over a million connected vehicles worldwide with sensors & compute needed for full self-driving, which is orders of magnitude more than everyone else combined, giving you the best possible dataset to work with"
2020-02-02,"“At Tesla, using AI to solve self-driving isn’t just icing on the cake, it the cake” - @lexfridman Join AI at Tesla! It reports directly to me &amp; we meet/email/text almost every day. My actions, not just words, show how critically I view (benign) AI."
2020-02-02,"Unfortunately, this is true. It doesn’t matter how skilled you are if you’re trapped in a giant bureaucracy."
2020-02-02,Desperate times call for desperate measures …
2020-02-02,"Only 66 years from first controlled, powered flight to landing on the moon. Now, half a century later, we are still unable to return. This must change."
2020-02-02,Haha true
2020-02-02,The safest place to hide a dead body is the second page of Google search results!
2020-02-02,"Trolls/bots just need to be deemphasized relative to probable real people who aren’t being paid to push an agenda or scam. Google still shows bs/scam pages, they’re just several clicks away."
2020-02-01,"This was a huge problem for search engines until Google applied the citation relevance principle aka PageRank, among many other things"
2020-02-01,Report as soon as you see it. Troll/bot networks on Twitter are a *dire* problem for adversely affecting public discourse & ripping people off. Just dropping their prominence as a function of probable gaming of the system would be a big improvement.
2020-02-01,The crypto scam level on Twitter is reaching new levels. This is not cool.
2020-02-01,Yes
2020-02-01,"We should make buildings out of high-strength steel, not concrete (which needs steel in it anyway)"
2020-02-01,Nice
2020-02-01,Don’t Doubt ur Vibe now on Spotify
2020-01-31,
2020-01-31,I appreciate the kind words!
2020-01-31,Those old ladies are wise
2020-01-31,"Meant to say other forms of “the cold”, not influenza https://en.m.wikipedia.org/wiki/Coronavirus"
2020-01-31,There is considerable conflation of diagnosis & contraction of “corona”. Actual virality is much lower than it would seem. I think this will turn out to be comparable to other forms of influenza. World War Z it is not.
2020-01-31,I become Tiesto at night
2020-01-31, 
2020-01-31,Vibbbe
2020-01-31,I wrote the lyrics & performed the vocals!!
2020-01-31,Be … cause … it’s … you
2020-01-31,
2020-01-31,Don’t Doubt ur Vibe
2020-01-31, this song is hard
2020-01-31,Hope you’re enjoying the simulation
2020-01-31,Be … cause … it’s … true
2020-01-31,крипто
2020-01-31,Releasing soon on Emo G Records!
2020-01-30,"Exactly. Mars propellant production will combine atmospheric CO2 & water (ice) to make CH4 (methane) & O2. Will do same on Earth long-term. Short-term, each Falcon flight uses roughly same fuel mass as a 747 flight. Falcon is ~71% oxygen & Starship is ~78%, so mostly not fuel."
2020-01-30,This number won’t leave me alone! 
2020-01-30,Just wrote a song called “Don’t doubt yer vibe”
2020-01-30,we r smôl
2020-01-30, 
2020-01-29,"Ok, not so bad"
2020-01-29,Who is hating on ISRU & why? Doesn’t make sense.
2020-01-29,A friend just sent me this excerpt from a Tesla blog I wrote 14 years ago
2020-01-29,"Tonnage delivered to orbit, normalized to LEO, would be interesting to see"
2020-01-29,"If all goes well, Falcon 9 will achieve triple digits this year"
2020-01-29,Ice
2020-01-29,8.5 bar
2020-01-29,Liquid nitrogen cryogenic strength test underway 
2020-01-29, 
2020-01-29,Matter is extremely fluffy!
2020-01-28,Chairs are underappreciated
2020-01-28,The stars in Starship’s mirrored hull reflected
2020-01-28,!
2020-01-28,Already being done
2020-01-28,"Parent material strength roughly doubles, so weld strength is the only real question mark"
2020-01-27,First two domes of SN1 are almost complete
2020-01-27,Yes
2020-01-27,Starship 9m test tank made 7.5 bar at room temp! Small leak at a weld doubler. Will be repaired & retested at cryo.
2020-01-26,The good old days!
2020-01-26,We’re working on it
2020-01-25,Too niche
2020-01-25,"A Tesla works as a boat for short periods of time, as an electric car has no air intake or exhaust to block & battery/motor/electronics are water-sealed. Submarines are just underwater EVs. https://m.youtube.com/watch?v=cBYFo6fXPvU"
2020-01-25,Nice
2020-01-25,Meme necromancy
2020-01-25,"Going with nomenclature of Giga [most widely understood location name] vs Giga #, so Giga Shanghai, Giga Nevada, Giga New York & Giga Berlin"
2020-01-25,"For sure. Giga Berlin will build sustainable energy vehicles using sustainable energy, so net environmental impact will be extremely positive!"
2020-01-25,Yes
2020-01-25,Yes
2020-01-25,Exactly!
2020-01-25,Giga Berlin / GF4 will absolutely be designed with sustainability and the environment in mind
2020-01-25,"Sounds like we need to clear up a few things! Tesla won’t use this much net water on a daily basis. It’s possibly a rare peak usage case, but not an everyday event. Also, this is not a natural forest — it was planted for use as cardboard & only a small part will be used for GF4."
2020-01-24,V3 Supercharger deployment will accelerate considerably this year
2020-01-24,
2020-01-23,"Yeah, system should adapt to most likely destination & anticipate school, then work, if that’s owner preference"
2020-01-23,Definitely
2020-01-23,Ok
2020-01-23,"We should have a base on the moon, a city on Mars"
2020-01-23,I love that Heart of Gold is moved by Infinite Improbability
2020-01-23,We should strive to extend the light of consciousness into the cosmos
2020-01-23,Star Peace 
2020-01-22,We’re working on it
2020-01-22,"Agreed, v important"
2020-01-22,Blazing Saddles
2020-01-22,Working on it
2020-01-22,It’s on the list
2020-01-22,Want to play The Witcher game on your Tesla? (you can already watch the show on Tesla Netflix theater)
2020-01-22,Explains the sad lack of progress in candy research!
2020-01-22,"Yeah, doors are 40 ft wide"
2020-01-22,"Yeah, we just finished two more propellant domes. SpaceX team & supporting suppliers are doing amazing work ramping Starship production."
2020-01-22,Nice shot
2020-01-22,Improved Accommodations
2020-01-21,Yay!
2020-01-21,Would like to take a moment to thank Michael & Ze’ev for helping Tesla. It was very hard work & both could’ve just rested on their laurels. Much appreciated .
2020-01-21, 
2020-01-21,Walk this way
2020-01-21,Great talking with @thirdrowtesla!
2020-01-21,
2020-01-21,"Michael Marks, then Ze’ev Drori, but I helped out as co-CEO as they didn’t have much automotive domain expertise"
2020-01-20,Dragon trunk from in-flight abort test is in surprisingly good shape!
2020-01-20,Exactly
2020-01-20,"Thanks on behalf of the @SpaceX team! Thank you also for the support @NASA has provided over the years, without which this would not have happened."
2020-01-19,Haha
2020-01-19,"Dragon high altitude, supersonic abort test is a risky mission, as it’s pushing the envelope in so many ways"
2020-01-19,5 mins from liftoff
2020-01-18,Yes
2020-01-18,
2020-01-18,Meteor!!
2020-01-17,Yes
2020-01-17,Best place to view is from the beach. Excitement guaranteed!
2020-01-17,"Dragon Spacecraft supersonic abort test coming up either tomorrow or Sunday, depending on weather @NASA @SpaceX"
2020-01-17,What should we change?
2020-01-17,"Munro’s analysis of Tesla engineering is accurate, both pro & con. I think he will appreciate some elements of the Model Y body design."
2020-01-17,"Even more important for a a reusable rocket, as cost of propellant actually becomes relevant & anything below T/W of 1 is wasted fuel & oxygen"
2020-01-17,Hehehe
2020-01-17,Helping to pay for this is why I’m accumulating assets on Earth.
2020-01-17,"Loading the Mars fleet into Earth orbit, then 1000 ships depart over ~30 days every 26 months. Battlestar Galactica …"
2020-01-17,"Aiming for 20 to 30 years, like aircraft"
2020-01-17,Yes. There will be a lot of jobs on Mars!
2020-01-17,"Needs to be such that anyone can go if they want, with loans available for those who don’t have money"
2020-01-17,Yeah. A lot of work is needed for propellant production on Mars.
2020-01-17,Yes
2020-01-17,That’s the goal
2020-01-17,Building 100 Starships/year gets to 1000 in 10 years or 100 megatons/year or maybe around 100k people per Earth-Mars orbital sync
2020-01-17,"Starship design goal is 3 flights/day avg rate, so ~1000 flights/year at >100 tons/flight, so every 10 ships yield 1 megaton per year to orbit"
2020-01-17,Megatons per year to orbit are needed for life to become multiplanetary
2020-01-17,That’s about right
2020-01-17,Reaction to Cyberpunk 2077 slipping release date to September
2020-01-16,"What’s amazing is how non-linear the effect of gravity is. Starship can travel by itself from surface of Mars to surface of Earth, but requires massive booster on Earth with orbital refilling to get to Mars, which is ~38% of Earth gravity."
2020-01-16,"Densification isn’t needed to return the ship & limited cargo from Mars, but it’s an option for increasing cargo return capability if needed"
2020-01-16,"Fundamental issue with SLS is that it’s not reusable, which means that a billion dollar rocket is blown up every launch! tragedy."
2020-01-16,"Densifying hydrogen is difficult, as its liquid temp is close to absolute zero. Much easier with CH4, which is an underappreciated advantage. Cooling O2 is good too, but becomes operationally difficult at N2 liquid temp, as air is ~78% N2. Entire system wants to drip air!"
2020-01-16,"Sorry, migh have brought the site down"
2020-01-16,"Starship orbital vehicle SN1, liquid oxygen header tank & nosecone"
2020-01-15,Just saw this today. Tesla refunds in general should be easy to get electronically & certainly through customer service. Will he addressed.
