date,tweet
2016-11-22,Backlog of 5 seat foldflat config. 6 seat can be made earlier. Actually my fav version.
2016-11-22,Love the pic tho
2016-11-22,Can anyone uncover who is really writing these fake pieces? Can't be skankhunt42. His work is better than this. http://finance.yahoo.com/news/elon-musk-vs-trolls-100011516.html;_ylc=X1MDMTE5Nzc4NDE4NQRfZXgDMQRfeXJpZAM4YWFjajNwYzM4cW1vBGcDZFhWcFpEeHVjejVoTnpjd1ptWTFNeTFqWVRabUxUTTNaV1V0WWpRNE9DMHpPVEpsWTJZek5URTVZbUk4Wm1sbGJHUStkSE5zWVE9PQRsYW5nA2VuLVVTBG9yaWdfbGFuZwNlbgRvcmlnX3JlZ2lvbgNVUwRwb3MDMwRyZWdpb24DVVMEc3ltYm9sA1RTTEE-?.tsrc=applewf
2016-11-19,perfect
2016-11-19,Longer version of self-driving demo with Paint It Black soundtrack
2016-11-19,That and Paint It Black will both be uploaded for free as Easter (holiday?) eggs
2016-11-19,yes
2016-11-19,-2
2016-11-19,Tesla self-driving AI with the Benny Hill option package https://www.tesla.com/videos/autopilot-self-driving-hardware-neighborhood-short/?utm_campaign=GL_AP_111816&amp;utm_source=Twitter&amp;utm_medium=social
2016-11-19,Consequences of population implosion greatly underestimated. Upside down demographic pyramid can't support social services.
2016-11-18,big mobile app update coming with 8.1 next month
2016-11-17,Vote tally shows ~85% of unaffiliated shareholders in favor of the Tesla/SolarCity merger! Thanks for believing.
2016-11-17,sounds right
2016-11-16,"All P100D vehicles produced to date, as well as new. This is purely a software optimization."
2016-11-16,Model X numbers should also improve by 0.1 sec on 0 to 60 and 1/4 mile
2016-11-16,Looks like the Model S P100D Easter egg will allow it to do 0 to 60 mph in 2.4 sec and a 10.6 sec 1/4 mile via software update next month
2016-11-16,"Wow, thanks. We won't let you down."
2016-11-16,"we could enable that, although the cameras use grey, grey, grey, red detection, so it would look a little greyish red :)"
2016-11-15,Love you too!
2016-11-07,"a bit like that, but hopefully a more meaningful role for humans"
2016-11-06,Playing Amish Paradise in my Tesla
2016-11-05,"Both UV and IR (for heat) reflective. I burn easily & then my nose looks like Rudolph the reindeer, so I totally understand."
2016-11-05,"No, but maybe a light tartan. Plaid is reserved for the next gen Roadster."
2016-11-05,I like humanity
2016-11-05,there will be something special
2016-11-05,"Tesla will def absorb SolarCity debt. Altho extremely unlikely, I would pay it personally if need be. Debts must be honored."
2016-11-05,My kids and I are having a great time!
2016-11-05,next software update fixes that
2016-11-04,might have an early access release ready by then
2016-11-04,now wouldn't that be interesting :)
2016-11-04,Here is how to vote your Tesla and SolarCity shares:
2016-11-04,hmmm
2016-11-04,one day ...
2016-11-04,it is not actually left-handed
2016-11-04,unless we do a deployable solar shield like a retractable hard top
2016-11-04,currently cycles radio favs. Next software release cycles between favs.
2016-11-04,Forgot to mention there will be a P100D Ludicrous Easter egg soon that uncorks the full performance
2016-11-04,no
2016-11-04,use buttons on left side of steering wheel
2016-11-04,@BBC_TopGear Thanks!
2016-11-04,"I'm the only author, so, love or hate it, that's me. I've learned some lessons though, such as tweeting on Ambien isn't wise."
2016-11-04,"I personally like the 6 seat best, but the new 5 allows the entire back to fold flat. A small family could camp there!"
2016-11-04,We will probably offer that as an option
2016-11-04,exactly
2016-11-04,Loving this thread :)
2016-11-04,Primarily aluminium with hot-stamped boron steel reinforcements. B pillar has a glass overlay.
2016-11-04,Excellent safety in rollover (5 star+). That was what took so long to develop.
2016-11-04,"In addition, we reinforced the surrounding body structure for improved safety (was already 5 star in all categories)."
2016-11-04,"I highly recommend the new all glass roof on the Model S. This was very hard to develop, but it makes the interior feel amazing."
2016-11-04,first solar roof deployments will start next summer
2016-11-04,Will be on @CNBC with Ron Baron in about half an hour http://finance.yahoo.com/video/ron-barons-300m-bet-tesla-102800448.html;_ylc=X1MDMTE5Nzc4NDE4NQRfZXgDMQRfeXJpZANlMGEwdTcxYzFwODViBGcDZFhWcFpEeHVjejR3WmpJME9UbGhNUzB3WmpRMExUTTBaV1F0T0RZelppMDBNR0V4TTJZelkyTm1Zamc4Wm1sbGJHUStkSE5zWVE9PQRsYW5nA2VuLVVTBG9yaWdfbGFuZwNlbgRvcmlnX3JlZ2lvbgNVUwRwb3MDNwRyZWdpb24DVVMEc3ltYm9sA1RTTEE-?.tsrc=applewf
2016-11-04,Great Model X article by @BBC_TopGear!
2016-11-04,"Institutional Shareholder Services, world's top independent evaluator, recommends in favor of Tesla-SolarCity merger"
2016-11-03,@XHNews Congratulations to China on the successful launch of the LM 5 heavy lift rocket!
2016-11-03,There would def be millions of agents simultaneously doing a Monte Carlo sim & combining the results to build a map of weaknesses
2016-11-03,good chance
2016-11-03,Only a matter of time before advanced AI is used to do this. Internet is particularly susceptible to a gradient descent algo.
2016-11-02,yes
2016-10-29,yes
2016-10-29,strongly net positive
2016-10-29,"Solar glass tiles can also incorporate heating elements, like rear defroster on a car, to clear roof of snow and keep generating energy"
2016-10-29,yes
2016-10-29,"Should mention that the Tesla solar roof is robust against any weather, incl heavy hail. Also, higher insulating value than a standard roof."
2016-10-29,Pushing start to ~5:45 to allow more people to arrive
2016-10-27,"Unveil happening at sunset, because that's when ..."
2016-10-27,Solar roof plus Powerwall 2.0 launch event will be webcast live on http://Tesla.com at 5:30pm PDT tomorrow
2016-10-27,Several UI improvements across the board in 8.01 (next few weeks) and 8.1 in Dec
2016-10-27,"Solar roof unveil now at 5:30pm sharp (need daylight, for obvious reasons) California time tomorrow."
2016-10-26,"Dear cult members, I love you"
2016-10-26,"fixing, but in a slightly different way"
2016-10-24,"yeah, great questions"
2016-10-23,"This will be under /r/spacex, not the general AMA. Meant to be supplemental to the IAC talk."
2016-10-23,AMA at 3pm California time
2016-10-22,Must be a coincidence
2016-10-20,"no, that's real"
2016-10-20,Using the automated solid metal snake charger :)
2016-10-20,yes
2016-10-20,"When you want your car to return, tap Summon on your phone. It will eventually find you even if you are on the other side of the country"
2016-10-20,"When searching for parking, the car reads the signs to see if it is allowed to park there, which is why it skipped the disabled spot"
2016-10-20,yes
2016-10-20,"8 cameras, 12 ultrasonars and radar all flush mounted and body color. Beauty remains."
2016-10-20,"Tesla drives itself (no human input at all) thru urban streets to highway to streets, then finds a parking spot"
2016-10-20,latest autonomous hardware allows for easy computer upgrade
2016-10-20,Should mention that retrofitting to full self-driving hardware is very difficult. Cost delta is more than buying a new car. Wish it weren't.
2016-10-20,Still working on the video. Fully autonomous drive demo only completed several hours ago.
2016-10-20,of course
2016-10-20,Tesla expects to demonstrate self-driven cross-country trip next year http://on.wsj.com/2dPVAr4 via @WSJ
2016-10-20,true and underappreciated
2016-10-20,Will post video of a Tesla navigating a complex urban environment shortly. That was what took the extra couple of days.
2016-10-19,This is also what I was alluding to by Model 3 part 2
2016-10-19,"According to experts, Hyperloop is both obvious and impossible. Maybe pick one or the other?"
2016-10-19,Tesla announcement goes live at 5pm California time. 30 minutes of media Q&A to follow.
2016-10-19,Calculated attempt to deceive Florida voters about solar vote uncovered by Miami Herald
2016-10-19,Tesla does 0-60 mph in 2.7 seconds in the rain https://electrek.co/2016/10/17/watch-a-tesla-model-s-p100d-do-0-60-in-2-7-seconds-in-the-rain/ via @electrekco
2016-10-18,This is because the first 12 months of production are sold out
2016-10-16,Moving the Tesla announcement to Wednesday. Needs a few more days of refinement.
2016-10-16,thanks!
2016-10-16,Umm...Autobahn?
2016-10-13,obviously wrong
2016-10-10,@heiseonline Not actually based on science. Objective data shows Autopilot is safer than manually driven cars.
2016-10-10,"@FortuneMagazine Utter nonsense. Empirical evidence is what matters, not random speculation."
2016-10-10,Sounds like a great move!
2016-10-10,Good for Germany!
2016-10-10,That's why we need to accelerate solar power
2016-10-10,"Real fraud going on is denial of climate science. As for ""subsidies"", Tesla gets pennies on dollar vs coal. How about we both go to zero?"
2016-10-10,Coal-mining CEO: 'Tesla is a fraud' http://finance.yahoo.com/video/robert-murray-tesla-fraud-120500192.html;_ylc=X1MDMTE5Nzc4NDE4NQRfZXgDMQRfeXJpZAMwcmFzcGJ0YnZuNmNwBGcDZFhWcFpEeHVjejR5TkRKak1XTm1ZUzB6WWpjMUxUTXlZVGt0T0RReU1pMWtZVFl5TldZME5URXdZMk04Wm1sbGJHUStkSE5zWVE9PQRsYW5nA2VuLVVTBG9yaWdfbGFuZwNlbgRvcmlnX3JlZ2lvbgNVUwRwb3MDMwRyZWdpb24DVVMEc3ltYm9sA1RTTEE-?soc_src=social-sh&amp;soc_trk=tw via @YahooFinance
2016-10-10,Translating what actually happened in the debates...
2016-10-09,impact velocity and center of mass of colliding object make a big difference
2016-10-09,Probably not then either
2016-10-09,Would also like to correct expectations that Tesla/SolarCity will need to raise equity or corp debt in Q4. Won't be necessary for either.
2016-10-09,"Tesla product unveiling on the 17th (unexpected by most), followed by Tesla/SolarCity on the 28th"
2016-10-09,I agree. Speed of light is a point in favor of the sim.
2016-10-07,"US automotive deaths rose 10% to 17,775 in first half of 2016, approx 1 every 88 million miles"
2016-10-07,Cumulative Tesla Autopilot miles now at 222 million
2016-10-07,lot of circumstantial evidence for that hypothesis
2016-10-06,Thus I deserve to be top of the target list? Maybe there's a dude who really digs the color gold who is slightly more deserving…
2016-10-06,"Yeah, and several others at various times. My twitter list is trimmed down to almost all news/comedy these days."
2016-10-05,"When we upgrade the core Linux OS to 4.4, which is probably December"
2016-10-05,"Sabotage of the rocket is unlikely, but this article has some great theories :)"
2016-10-04,"True, it is a no-win situation"
2016-10-04,I use twitter for news orgs. My Insta has same women as men. What's up with the phoney PC police axe-grinding?
2016-10-02,Exactly. Those are the best ones.
2016-10-02,Going out this week for X and outside North America
2016-10-02,"Wow, this tweet is like a Rorschach test"
2016-10-02,"No irony or uhh ""shade"" meant here. T's character is excellent and well-played. Worth seeing."
2016-10-02,Some of the future episodes of Westworld feature my ex. Talulah does a great job of playing a deadly sexbot :)
2016-10-02,More Kerbal!
2016-10-01,yes
2016-10-01,Will do a Reddit AMA on Mars in the next week or two
2016-09-28,"Corrective action taken. Seems to be limited to a small number of cases, but thanks for letting me know."
2016-09-28,Am tracking this down ... Super important to be fair. There are zero discounts even for family and friends.
2016-09-28,Something messed up here. Tesla policy is equal pricing for all. No discounts ever unless a car is a floor model or was damaged.
2016-09-28,"Three cable elevator on a crane. Wind force on Mars is low, so don't need to worry about being blown around."
2016-09-27,A Million Humans Could Live on Mars By the 2060s http://on.natgeo.com/2cTNcqn via @NatGeo
2016-09-27,Good article on the interplanetary transport system on Gizmodo
2016-09-27,Waiting for everyone to reach their seats and get settled. Starting in 5 to 10.
2016-09-27,"12m rocket booster diameter, 17m spaceship diameter, 122 m stack height"
2016-09-27,Full Interplanetary Tranport System presentation in ~30 mins. Simulation preview:
2016-09-27,"Meant to say 200 AR for production vac engine. Dev will be up to 150. Beyond that, too much flow separation in Earth atmos."
2016-09-26,yup
2016-09-26,yes
2016-09-26,yes
2016-09-26,pretty close
2016-09-26,382s is with a 150 area ratio vacuum (or Mars ambient pressure) nozzle. Will go over specs for both versions on Tues.
2016-09-26,"Chamber pressure is almost 3X Merlin, so engine is about the same size for a given area ratio"
2016-09-26,Production Raptor goal is specific impulse of 382 seconds and thrust of 3 MN (~310 metric tons) at 300 bar
2016-09-26,Mach diamonds
2016-09-26,SpaceX propulsion just achieved first firing of the Raptor interplanetary transport engine
2016-09-23,Good Forbes article on Tesla/SolarCity merger http://www.forbes.com/sites/adamhartung/2016/09/23/why-investors-should-support-the-tesla-solarcity-merger/?utm_source=yahoo&amp;utm_medium=partner&amp;utm_campaign=yahootix&amp;partner=yahootix#329d7ef64c32
2016-09-22,Aiming for Oct 28 unveil in SF Bay Area of new Tesla/SolarCity solar roof with integrated Powerwall 2.0 battery and Tesla charger.
2016-09-22,"yes. Also, only worked if you logged on to a malicious hotspot & used browser. No customers were hacked."
2016-09-22,thanks for ordering a car!
2016-09-22,"Tesla is sometimes criticized for government support, but all US car companies (plus some non) got loans and only Tesla has paid its back"
2016-09-21,I read a story about a father whose son died incredibly quickly. Can be as little as half an hour in hot sun.
2016-09-21,currently stops at 20% state of charge. This number will be configurable.
2016-09-21,"""smart"" preconditioning should be less dumb in 8.0"
2016-09-21,"also, the Tesla is poison free!"
2016-09-21,all cars
2016-09-21,can't always detect babies and pets
2016-09-21,Can be turned on or off. V8.1 will allow always-on min and max temps to be set.
2016-09-21,Tesla keeps temp below 40C/105F by automatically venting cabin & turning on AC when needed. Can do this for up to a year on a full charge.
2016-09-21,My favorite new feature is the always-on max temp control for keeping kids and pets safe from overheating.
2016-09-21,This is a major overhaul on almost every level compared to V7.
2016-09-21,"V8.0 starts downloading tonight. Release will be gradual to make sure there aren't small regressions. Many car configs, many environments."
2016-09-19,"Yeah, definitely one of my favorite names"
2016-09-18,its it is
2016-09-18,Preview of the @SpaceX interplanetary transport system at @IAC2016
2016-09-17,that's a great one
2016-09-17,sounds like the right name for the rocket booster
2016-09-17,That is my favorite fictional spaceship. Powered by improbability!
2016-09-17,yeah!
2016-09-17,"Maybe Ultimate Spaceship, Version 2? Mostly because it is not the ultimate and there isn't a version 1."
2016-09-17,I love the suggestions!
2016-09-17,sounds about right
2016-09-17,"Turns out MCT can go well beyond Mars, so will need a new name…"
2016-09-16,yes
2016-09-16,won't affect performance
2016-09-16,Hoping to start WW rollout of 8.0 on Wednesday if no last minute issues discovered.
2016-09-16,Tesla P100D put to the test by Drag Times
2016-09-16,Glad you like it! I think we will probably stop at 100 kWh on battery size.
2016-09-16,Turns out ExxonMobil not 100% forthcoming about climate change http://bloom.bg/2cFtsLJ via @BW
2016-09-13,"Tesla Model S loses 28% after 50k miles, a Mercedes S-Class will lose 38%, a BMW 7-series will lose 40%, and an Audi A8 will lose 41%."
2016-09-13,Comprehensive study by Autolist shows that a Tesla retains its value far better than gasoline sedans
2016-09-13,Scientists: Earth Endangered by New Strain of Fact-Resistant Humans http://www.newyorker.com/humor/borowitz-report/scientists-earth-endangered-by-new-strain-of-fact-resistant-humans via @BorowitzReport
2016-09-13,Climate change explained in comic book form by xkcd
2016-09-10,Will do some press Q&A on Autopilot post at 11am PDT tmrw and then publish at noon. Sorry about delay. Unusually difficult couple of weeks.
2016-09-09,Thoughtful Op-ed in Space News much appreciated
2016-09-09,"@abadcliche Most likely true, but we can't yet find it on any vehicle sensors"
2016-09-09,Will get back to Autopilot update blog tomorrow.
2016-09-09,We have not ruled that out.
2016-09-09,"nope, it wasn't me"
2016-09-09,Particularly trying to understand the quieter bang sound a few seconds before the fireball goes off. May come from rocket or something else.
2016-09-09,"Support & advice from @NASA, @FAA, @AFPAA &amp; others much appreciated. Please email any recordings of the event to report@spacex.com."
2016-09-09,Important to note that this happened during a routine filling operation. Engines were not on and there was no apparent heat source.
2016-09-09,Still working on the Falcon fireball investigation. Turning out to be the most difficult and complex failure we have ever had in 14 years.
2016-09-09,It's been a little crazy lately
2016-09-01,"yes. This seems instant from a human perspective, but it really a fast fire, not an explosion. Dragon would have been fine."
2016-09-01,Finishing Autopilot blog postponed to end of weekend
2016-09-01,Loss of Falcon vehicle today during propellant fill operation. Originated around upper stage oxygen tank. Cause still unknown. More soon.
2016-08-31,"Not allowed, according to HK regulations. Happy to do it if regs change."
2016-08-31,We need to do one more minor rev on 8.0 and then will go to wide release in a few weeks
2016-08-31,Writing post now with details. Will publish on Tesla website later today.
2016-08-31,Major improvements to Autopilot coming with V8.0 and 8.1 software (std OTA update) primarily through advanced processing of radar signals
2016-08-31,uh oh
2016-08-30,Thanks for the longstanding faith in SpaceX. We very much look forward to doing this milestone flight with you.
2016-08-28,one of my favorite games as a kid
2016-08-28,Making progress. Maybe something to announce in a few months. Have played all prior Deus Ex. Not this one yet.
2016-08-23,Journalist Q&A for 30 mins and embargo ends at 12:30
2016-08-23,Tesla product announcement at noon California time today
2016-08-22,Owner account of a Model X severely impacted by a Yukon
2016-08-15,Correlation is not causality or ... is it? http://www.tylervigen.com/spurious-correlations
2016-08-14,Sunday morning: to bake or not to bake cookies -- that is not even a question. Definitely bake.
2016-08-11,"Congrats to @TalulahRiley on her novel, ""Acts of Love""! All characters – even those based on real people – are entirely fictional …"
2016-08-10,Over the entrance of @OpenAI
2016-08-09,true
2016-08-09,Will try out @NoMansSky this weekend. Maybe reality is just a series of nested simulations all the way down ... https://en.m.wikipedia.org/wiki/Turtles_all_the_way_down
2016-08-09,Would like to thank @nvidia and Jensen for donating the first DGX-1 AI supercomputer to @OpenAI in support of democratizing AI technology
2016-08-09,"Yeah. Movie still enjoyable due to some great characters, but plot & editing could've been better. Really needed more Joker+Harley."
2016-08-07,Sure feels weird to find myself defending the robots
2016-08-01,Never. There is no product rationale for doing so.
2016-07-31,probably makes sense to build off the pickup truck chassis
2016-07-31,Model Y (compact SUV) off Model 3 chassis. Tesla Bus/Minibus/Spacebus off Model X.
2016-07-30,good point
2016-07-30,I think we should be inconsistent in our naming conventions after Model Y
2016-07-30,View of Dragon from @Space_Station cupola
2016-07-30,We are definitely patenting this idea
2016-07-30,glad people had a great time!
2016-07-30,"not bad, I like those suggestions"
2016-07-30,Gigafactory in units of hamster
2016-07-29,Some good guessing by @Jalopnik. The Tesla Minibus will be built on a Model X chassis. People density potential is surprisingly high.
2016-07-29,Will be live streaming the Gigafactory launch party tonight. Check http://tesla.com this eve.
2016-07-29,The libertarian argument for a carbon tax
2016-07-28,"Good summary of yesterday's Gigafactory Q&A with JB, Yamada-San and me"
2016-07-27,Should mention that Gigafactory will be fully powered by clean energy when complete & include battery recycling
2016-07-27,happy birthday!
2016-07-26,Insurance premiums expected to decline by 80% due to driverless cars
2016-07-26,Letter from basically every scientific org in the United States to Congress about climate change
2016-07-26,Via @NPR: Sun-Powered Airplane Completes Historic Trip Around The World http://n.pr/2ae2mrI
2016-07-25,Maybe as a future optimization. Would only matter if it was extremely big.
2016-07-23,as long as I'm alive
2016-07-23,
2016-07-22,Looking forward to the Gigafactory opening party on Friday next week. The scale blows me away every time I see it.
2016-07-21,Autopilot prevents serious injury or death of a pedestrian in NY (owner anecdote confirmed by vehicle logs)
2016-07-21,"Jerome is driving Tesla Semi & doing a great job with his team. At Daimler, he led their most successful semi truck program ever."
2016-07-21,It's inspired by some of the California Custom VW combi design art
2016-07-21,Great game. Whole Fallout series is amazing.
2016-07-21,Both should have been done under the same corporate umbrella from the beginning
2016-07-21,"Tesla Master Plan, Part Deux"
2016-07-20,now 2Pac
2016-07-20,California time
2016-07-20,Post should go live on Tesla website around 5pm
2016-07-20,yup
2016-07-20,busted
2016-07-20,Except for the tweet about large amounts of crack (actually just small amounts)
2016-07-20,Not easy to convey irony in a tweet
2016-07-20,Lana
2016-07-20,Finishing off the plan while listening to the soundtrack from Gatsby. Seems appropriate...
2016-07-19,"Will be working at Tesla on Autopilot & Model 3 today, then aiming to pull an all-nighter and complete the master product plan"
2016-07-19,I am!
2016-07-19,Returning from Cape Canaveral to California...
2016-07-18,"Really tempting to redesign upper stage for return too (Falcon Heavy has enough power), but prob best to stay focused on the Mars rocket"
2016-07-18,Can't wait to see all three cores of Falcon Heavy come back for landings! First two will be almost simultaneous.
2016-07-18,Landing
2016-07-18,free Babel fish provided
2016-07-18,Bit of a distraction yesterday. Working on plan today.
2016-07-18,Out on LZ-1. We just completed the post-landing inspection and all systems look good. Ready to fly again.
2016-07-18,Falcon on LZ-1 at Cape Canaveral
2016-07-18,"Thanks. Exactly. Some in the press think they're so much smarter than Tesla owners that ""they know better"". Makes no sense."
2016-07-17,"V8 will be our biggest release since v1, so taking longer to refine. Awesome on every level. Meeting w design team every day."
2016-07-17,"Tesla customers are v smart & don't want media speaking on their behalf abt Autopilot. Recent poll: 0.0% want it disabled -- not 0.1%, 0.0%."
2016-07-17,"It can at moderate range, but our ultrasonics are very good at human (or anything >= water density) detection"
2016-07-17,Improved fan speed algorithm coming soon. Doesn't need to be so loud.
2016-07-17,Great rebuttal by a Tesla owner to those calling for Autopilot to be disabled. Was written with zero input from us.
2016-07-17,That is a very good point!
2016-07-17,Have to focus on tonight's @SpaceX launch. Will post Tesla (master) product plan afterwards.
2016-07-17,"Btw, want to thank both Bosch and MobilEye for their help and support in making Autopilot better. Please direct all criticism at Tesla."
2016-07-17,"Promising call today with @BoschGlobal, maker of our radar sensor. Looks like significant improvements possible via OTA software update."
2016-07-17,much appreciated
2016-07-17,Usually true. We need more sane and reasonable people making their voice heard.
2016-07-17,Sensible article on Autopilot by @the guardian
2016-07-16,On the other hand I do answer a toy phone like it's real
2016-07-16,large amounts of crack
2016-07-16,"6 hours normally, but a lot less these days"
2016-07-16,Sunday is the end of the week :)
2016-07-16,yes
2016-07-16,good up to ~160km/h
2016-07-16,Our radar is using a wavelength of 3.9mm. A good size for both decent resolution and rain penetration. Am hopeful...
2016-07-15,especially well
2016-07-15,Logs were downloaded for NHTSA and NTSB. Identical copies to all.
2016-07-15,"Good thing about radar is that, unlike lidar (which is visible wavelength), it can see through rain, snow, fog and dust"
2016-07-15,yes
2016-07-15,certainly moderate and maybe big advances w no incremental hardware
2016-07-15,effective stereo by comparing data at various points in time while moving
2016-07-15,elevation too
2016-07-15,only just gained access to physical vehicle
2016-07-15,AP process crash would show up in logs
2016-07-15,"Working on using existing Tesla radar by itself (decoupled from camera) w temporal smoothing to create a coarse point cloud, like lidar"
2016-07-15,"Maybe didn't realize he turned it off, but the car does issue a loud chime and a visual warning on the instrument cluster."
2016-07-14,exactly
2016-07-14,"Onboard vehicle logs show Autopilot was turned off in Pennsylvania crash. Moreover, crash would not have occurred if it was on."
2016-07-14,EU regulators find no safety concerns with Autopilot
2016-07-14,It's all fun & games until ... https://en.m.wikipedia.org/wiki/Skynet_(Terminator)
2016-07-13,We don't mind taking the heat for customer safety. It is the right thing to do. From @RoadandTrack
2016-07-12,can't wait to see the costume
2016-07-12,@FredericLambert Only if I can play a monkey
2016-07-12,"Tesla finishes last in being salesy! Good. Also, I can't believe there is a real Pied Piper."
2016-07-10,Something like that
2016-07-10,already taken care of
2016-07-10,Kinda. Creating a seamlessly integrated Tesla battery & solar power product that looks beautiful is the reason
2016-07-10,I like your tweets!
