date,tweet
2018-06-23,Expanding the tour soon. So many cool things to see. Tesla car factory has 3rd largest footprint of any building on Earth. Maybe 1st if you include all our sweet tents 
2018-06-23,Looks so sus when we paint cars red
2018-06-23,Which rolls out today
2018-06-23,Will be there in next release
2018-06-23,So big you can’t believe it
2018-06-23,srsly https://twitter.com/dkthomp/status/1010191063640956928
2018-06-23,Vicious torque
2018-06-23,Tesla factory rn
2018-06-23,#donotpanic
2018-06-23,.@WidespreadPanic
2018-06-23,Good catch!
2018-06-23,
2018-06-23,Exactly 
2018-06-23,What is my purpose? Sentient seats.
2018-06-23,Thanks 
2018-06-22,"At Fremont until late tonight, Giga tomorrow, Fremont Sunday. GA4 is great, but have to say that GA3 crew is pulling off miracles against all odds."
2018-06-22,"Infinity Work, the Reality game"
2018-06-22,"That would be tricky to sequence, but maybe"
2018-06-22,Was thinking of offering an extended Tesla factory tour option where you could help build part of a car & understand how they come together. I know it would have been super fun for me when I was a kid (or now).
2018-06-22,It’s called Top Secret
2018-06-22,Yes
2018-06-22,"When I was a kid, I built model airplanes, trainsets, rockets (mixed my own powder), explosives (kinda surprised I still have all fingers), a radio, lots of software. Built a primitive MRI machine in college."
2018-06-22,"Yeah, but I’m not sure what the big deal is. I like building things. If that ends up being useful work too, even better."
2018-06-22,We will add a config to lower the alert
2018-06-22,Apply light force to the steering wheel. Alert is being changed to this text.
2018-06-22,Try saying “bug report”. Might work better. Ironic if the bug report about bug reports isn’t working :)
2018-06-22,"Thanks for the feedback, will investigate"
2018-06-22,Sure
2018-06-22,Congratulations!
2018-06-22,It’s actually pretty fun building electric cars. Product is useful to other people & good for environment. I think that’s fundamental goodness.
2018-06-22,"Btw, if anyone else wants to build this tunnel, please do so. It’s a lot of work."
2018-06-21,Stop being such a Jacobin 
2018-06-21,Frank Herbert & Falcon Heavy
2018-06-21,"Without change, something sleeps inside us, and seldom awakens. The sleeper must awaken. FH …"
2018-06-21,Dune. The spice must flow.
2018-06-21,
2018-06-21,“We power the press” in 1997. Ironic.
2018-06-20,@Money23Green Thanks for coming by our car factory with @westcoastbill. Tesla team was super fired up to see you! Congrats on your victory!!
2018-06-20,"Crazy, that was over 22 years ago. Thanks for believing in us!"
2018-06-20,"There is more, but the actions of a few bad apples will not stop Tesla from reaching its goals. With 40,000 people, the worst 1 in 1000 will have issues. That’s still ~40 people."
2018-06-20,Today. It’s kinda there in US with welfare but rules are messed up and amount is too low.
2018-06-20,Also think there should be a universal basic income that doesn’t change even if you get a job. Productivity should be rewarded.
2018-06-20,Because honey is a vegetable
2018-06-20,Considerably less so than our competitors (longer discussion)
2018-06-20,"Yes, consumption tax is way better. Also, higher estate tax better than income/cap gains tax. Probability of progeny being equally excellent at capital allocation is not high."
2018-06-20,Exactly
2018-06-20,"He’s obv wrong. Forcing function for any 100% mkt share monopolist to improve is weak & a national govt is that by fiat. One may find lowish correlation for negativity, but that does not mean low causation."
2018-06-20,Great name. A little on the nose.
2018-06-20,"That’s really decision about how good you think govt is at allocating capital. Buffett, for example, is vastly better than any govt at allocating capital. Consumption vs capital allocation extremely misunderstood. Biggest missing piece in public understanding of what “money” is."
2018-06-20,"Yeah, all-inclusive tax rate of 40% seems about right. Below 30% is unrealistic for critical govt functions unless national defense is de facto outsourced & above 50% too negatively affects economic output."
2018-06-19,Cool video
2018-06-19,Thank you for helping those in need
2018-06-19,"To be clear, Tesla European Headquarters will remain in Netherlands"
2018-06-19,Yup
2018-06-19,"That’s ridiculous, lions can’t vote, they don’t even have opposable thumbs. Also, they’d need 61%, so no."
2018-06-19,"Germany is a leading choice for Europe. Perhaps on the German-French border makes sense, near the Benelux countries"
2018-06-19,Brevity is the sole meunière of wit
2018-06-19,Original Star Wars
2018-06-19,Hahaha
2018-06-19,"Die fröhliche Wissenschaft und Eristische Dialektik: Die Kunst, Recht zu Behalten"
2018-06-19,Das war ein unbeabsichtigter Witz 
2018-06-19,Vielleicht muss ich die Kirche im Dorf verlassen?
2018-06-19,Will do. Am enquiring on many channels. Regards to Scott.
2018-06-19,Do you know anyone who has gone there?
2018-06-19,Where are they?
2018-06-19,Where are you going to march?
2018-06-19,That seems unlikely
2018-06-19,"Just because I donate doesn’t mean I support every last thing a person or organization does, but I like all the people I’ve met from @ACLU. They really care about doing good."
2018-06-19,I am one of the top donors to @ACLU
2018-06-19,"I couldn’t even keep the US in the Paris Accord, but if there is some way for me to help these kids I will do so"
2018-06-19,I think so
2018-06-19,I hope the kids are ok
2018-06-19,Shelter
2018-06-19,You’re probably right. Maybe after Tesla drama calms down.
2018-06-19,I’m at the factory a lot. Pretty good workout just walking around. It’s big.
2018-06-19,They look beautiful
2018-06-19,Will maybe do a media tour next week. Team deserves recognition. This was miraculous.
2018-06-19,It’s actually way better than the factory building. More comfortable & a great view of the mountains.
2018-06-19,Not sure we actually need a building. This tent is pretty sweet. Tesla Grohmann line is in place at Giga & spooling up now. They super kicked ass too. Heiliger Strohsack!
2018-06-19,They also poured the concrete & built the whole assembly line using scrap we had in warehouses. And it’s way better than the other GA line that cost hundreds of millions!
2018-06-19,No
2018-06-19,"Needed another general assembly line to reach 5k/week Model 3 production. A new building was impossible, so we built a giant tent in 2 weeks. Tesla team kfa!! Gah, love them so much "
2018-06-19,"You’re welcome, bad fiction writer 78"
2018-06-18,"Dude, we are California, which is extremely pro union. People can form a union tomorrow & nothing Tesla could do to stop it. UAW can’t even get enough sigs to request a vote, cause they have nothing to offer."
2018-06-18,Your union brothers
2018-06-18,You won’t find pro-union either. The books are all about freedom. No one is forced to join any organization.
2018-06-18,"Thanks, good advice"
2018-06-17,They have about three weeks before their short position explodes
2018-06-17,Good points. Already mostly working in the developer software I’m driving.
2018-06-17,Can’t wait for the new @RickandMorty season to start!
2018-06-17,"We’ve always provided healthcare, hourly wages above union & Tesla stock. Also, free drinks & snacks. Try to make it fun too. Top ten hourly workers cumulatively received Tesla stock now worth $1M to $2M. Nobody wants UAW, so UAW keeps trashing Tesla & me via 3rd parties."
2018-06-17,Glad you teach physics. That and critical thinking (ie how not to be tricked) are foundational for all kids to learn.
2018-06-17,"Yeah, I think we pretty much agree. Btw, great show."
2018-06-17,"I think essential services, incl health care, should be taken care of by govt/taxpayers (socialist) & other parts of economy should be served by companies competing to serve the people (capitalist). Aka, the view held by most of America."
2018-06-17,They started it & attacked me personally
2018-06-17,Search UAW and “corruption”. Very long reading list. Great organization.
2018-06-17,“Profit” just means you earned more money than you spent & certainly does spark innovation. Jesus. This is obv a good thing & extremely hard. It has taken Tesla 15 years & we’re almost there. Every other US car company besides Ford & Tesla has gone bankrupt.
2018-06-17,They don’t seem to think much or care about the future beyond a narrow horizon
2018-06-17,Engels wrote 2nd & 3rd volumes based on Marx’s “notes”. Less reliable.
2018-06-17,"Wanted to help transition the world to sustainable, clean energy and extend life as we know it beyond Earth. Those problems require a lot of hardware."
2018-06-17,"Wow, you know nothing & are worthy of contempt. The world is under massive attack due to climate change & you couldn’t care less."
2018-06-17,"Read it. Like the green, translucent Martian opal?"
2018-06-17,Iron pyrite
2018-06-17,Congratulations to LA Times and Patrick Soon-Shiong!
2018-06-17,"You’re just a troll/bot, but I will reply anyway. I arrived in Montreal at 17 by myself with $2k. No support, no contacts, nothing. Father said I’d fail & be back in 3 months."
2018-06-17,"I don’t want to see anyone lose their money. Or I will at least provide fair warning before it happens, as I have done in the past."
2018-06-17,You think all companies are bad and all unions good? That’s a very bigoted position.
2018-06-17,Well said
2018-06-17,Then you’ll be fine
2018-06-17,Exactly. Our NDA is actually shorter & simpler than most.
2018-06-17,"...which clearly doesn’t work. UAW and Wall Street shorts know every detail of what’s happening at Tesla. Storm clouds are gathering, so they’re getting desperate."
2018-06-17,"Then look a little closer, doctorow. Read the whole thread."
2018-06-17,More propaganda. The NDA only prevents disclosure of Tesla proprietary IP or material non-public information (insider trading).
2018-06-17,How big is your short position? Just curious.
2018-06-17,Union flyers are handed out all the time in the factory. I know because people in the factory laugh at the ridiculous propaganda & hand them to me. This one guy’s claim about being stopped once in a parking lot is false and irrelevant.
2018-06-17,"I endorse freedom to form a union too, as well as freedom not to do so if they feel Tesla is a good company. UAW has major conflicts of interest & failed our car plant already when they abandoned us in 2010. Tesla can only hire 5% of applicants, so must be doing something right."
2018-06-17,"UAW doesn’t have 30% of signatures (about 6000 people) needed for a vote. They can’t even muster enough people for a free bbq. Instead, they’re getting paid trolls & far left shills to trash Tesla & me in press & social media. Such creeps."
2018-06-17,"I’m not against all unions, but UAW has a track record of destroying productivity so a company can’t compete on world market. Our current factory went bankrupt under UAW before we took it over. Don’t want Tesla to die too."
2018-06-17,"I am too, of sorts. Govt (ie other taxpayers) should take care of critical needs of people, incl defense, judiciary, health care, etc. Rest should be companies competing to provide best product or service to the people."
2018-06-17,"Was originally called Puff the Magic Dragon, as people said I was high if though it could work, so I named it after their insult."
2018-06-17,"Iain certainly wasn’t pro-union in the Culture books. At all. And wouldn’t be in the case of Tesla. Banks was about freedom through & through. Maybe for a single buyer (monopsony) vs single seller (monopoly), I would be too, but that’s a special case."
2018-06-17,
2018-06-17,"SX 300 & soon SX 500. Kind of a modern version of Inconel superalloys. High strength at temperature, extreme oxidation resistance. Needed for ~800 atmosphere, hot, oxygen-rich turbopump on Raptor rocket engine."
2018-06-17,"Structures, engines, avionics, guidance & control software, new alloys, space lasers (ooh, maybe I shouldn’t have said that) …"
2018-06-17,Love you too 
2018-06-17, 
2018-06-17,Fair point
2018-06-17,"Auto-semiotic asphyxiation (sorry, couldn’t resist)"
2018-06-17,And I don’t trust that Engels guy. He could have made up most of 2nd & 3rd volumes. Nobody actually knows.
2018-06-17,Your math isn’t very good. Would require 61%. And what’s your issue anyway? Better suggestions are welcome.
2018-06-17,The Semi-erotics of Evil
2018-06-17,I dare you to stop following me. Do it.
2018-06-17,Ok
2018-06-17,The enemy of my enemy is myself
2018-06-17,Exactly
2018-06-17,Libertinarian
2018-06-16,"Direct democracy by the people. Laws must be short, as there is trickery in length. Automatic expiration of rules to prevent death by bureaucracy. Any rule can be removed by 40% of people to overcome inertia. Freedom."
2018-06-16,The mind sacrificing itself in the final ship battle
2018-06-16,"All of them, especially Surface Detail"
2018-06-16,"If you must know, I am a utopian anarchist of the kind best described by Iain Banks"
2018-06-16,I disagree with that goal & gave away Tesla patents to help other companies
2018-06-16,"If I’m not a communist, why do I make red cars "
2018-06-16,"Very appealing if you’re a sophomore in college. It’s a counterpoint to communism and useful as such, but should be tempered with kindness."
2018-06-16,That is why it is critical to support competition. Excess profits draw in competitors who then drive down prices.
2018-06-16,lol
2018-06-16,"Read Das Kapital when I was 14, incl cross-checking English translation of original German. Adam Smith FTW obv. Ironically, future automation will naturally lead to greater equality of consumption. Monopolies are true enemy of people. Competing to serve is good."
2018-06-16,Might actually be his!
2018-06-16,Amazing work by Tesla team. Built entire new general assembly line in 3 weeks w minimal resources. Love u guys so much! Pic of 1st Model 3 dual motor performance coming off the line …
2018-06-16,You’re a docile puppet of the UAW. Be honest about what you are.
2018-06-16,Yes
2018-06-16,Sigh
2018-06-16,"By the way, I am actually a socialist. Just not the kind that shifts resources from most productive to least productive, pretending to do good, while actually causing harm. True socialism seeks greatest good for all."
2018-06-16,“No sense of humor” is certainly proving itself true. Good grief! How many socialists does it take to screw in a lightbulb? Answer: That’s not funny!!
2018-06-16,"Boys High is a government school for anyone local, which we were"
2018-06-16,Lake Show
2018-06-16,"Heading back into the factory, so that’s enough for now. Don’t take my Tweet too seriously. For one thing, it’s called a “Tweet”."
2018-06-16,No
2018-06-16,My father has no money. Only reason he even has a house is because my brother & I bought it for him on condition that he not cause harm to others. That obviously failed.
2018-06-15,"There is considerable confusion between wealth as consumption & wealth as labor allocation. By latter measure, anyone in govt whose budget exceeds $1B is a billionaire. Government is the largest corporation."
2018-06-15,Socialism vs capitalism is not even the right question. What really matters is avoiding monopolies that restrict people’s freedom.
2018-06-15,Universal income will be necessary over time if AI takes over most human jobs
2018-06-15,Marx was a capitalist. He even wrote a book about it.
2018-06-15,A socialist
2018-06-15,"Those who proclaim themselves “socialists” are usually depressing, have no sense of humor & attended an expensive college. Fate loves irony."
2018-06-15,What is yours?
2018-06-15,What is your utopia?
2018-06-15,The future is a set of branching probability streams. Some actions by humanity have an extremely leveraged effect on shape & size of those streams.
2018-06-15,Strongly disagree. I love humanity.
2018-06-15,"Already did. Meant to go longer, but ran out of time."
2018-06-15,I always wanted to do a terms & conditions cover of Green Eggs & Ham
2018-06-15,Foundation Series & Zeroth Law are fundamental to creation of SpaceX
2018-06-15,I love Banks. Best books in recent years imo are Iain Banks & George Martin.
2018-06-15,"Given how bad I am at poetry, probably Vogon"
2018-06-15,Should prob articulate philosophy underlying my actions. It’s pretty simple & mostly influenced by Douglas Adams & Isaac Asimov.
2018-06-15,My donations are anonymous
2018-06-15,Already sold >$100M TSLA for charity. Will do about that every few years. Major disbursements in about 20 years when Tesla is steady state.
2018-06-15,"My “pay” is in options, which only matter if stock goes up & I sell. Will use that to make life multiplanetary, help education & environment on Earth w my foundation. Just don’t want us to be sad about the future."
2018-06-14,Dankonia
2018-06-13,We use less than 3% cobalt in our batteries & will use none in next gen
2018-06-13,"Yes, interface will change with Version 9 software"
2018-06-13,"Will be adjusting screen alert to clarify that we mean “slight up or downward force on the wheel”, not really “hold the wheel”"
2018-06-12,"Some very, very tough calls. Had to let go of good people, but I think they will find new jobs quickly."
2018-06-12,"Difficult, but necessary Tesla reorg underway. My email to the company has already leaked to media. Here it is unfiltered:"
2018-06-11,That is actual footage
2018-06-11,Back in the Precambrian era when the main form of life was a sponge
2018-06-10,Thanks! Have heard universally great things about your podcasts.
2018-06-10,"Of course, but it’s the kind of hustle that you like even with full knowledge. People can obv read the Internet & anyone who wants a refund will get one. I predict basically zero. The honest-to-goodness fun value is amazing & we’re never going to make them again."
2018-06-10,"Trade is just that Roadster becomes a 2 seater instead of a 2+2. COPV in place of the kid seats, which is prob wise for many reasons"
2018-06-10,"Exactly. Total energy stored even in ultra compressed air is low vs battery, but power output is insane. The composite overwrapped pressure vessel (COPV) is most advanced ever made. It’s what SpaceX is qualifying for NASA crewed missions. Extremely robust — literally bulletproof."
2018-06-10,Not recommended for urban environments
2018-06-10,Yes
2018-06-10,"The actual amount of time I spend on Twitter is tiny. My tweets are literally what I’m thinking at the moment, not carefully crafted corporate bs, which is really just banal propaganda."
2018-06-10,It is amazingly hard to find a simple solution. A complicated one is relatively easy.
2018-06-10,Love this design. Simpler the better.
2018-06-10,Add an R for Roadster 
2018-06-10,"Sigh. This is crux of matter: can’t make system too annoying or people won’t use it, negatively affecting safety, but also can’t allow people to get too complacent or safety again suffers. Latest update should have a positive effect on latter issue especially."
2018-06-10,A lot of people whose judgment I respect have suggested this. Sounds like a good idea. Will do so after Model 3 production reaches 5k/week steady.
2018-06-10,"Yes. Hopefully, I’m not tempting fate too much with that date. It was meant as a joke, but is about the right actual timing."
2018-06-10,Will do
2018-06-10,"Correct, pure electric. Wish orbital rockets could be so too, but there’s no escaping Newton’s Third Law. SpaceX is already developing high efficiency CO2 capture with H2O to form liquid CH4 (methane) & O2. Critical for propellant production at Mars Base Alpha."
2018-06-10,"You have my word, Marques. Next gen Roadster will be absolutely out of this world. For those who love to drive, there is no finer car in history and we don’t think there will be another."
2018-06-10,"Note, gas contained would be ultra high pressure air in a SpaceX rocket COPV bottle. The air exiting the thrusters would immediately be replenished whenever vehicle pack power draw allowed operation of the air pump, which is most of the time."
2018-06-10,"Intent of new Tesla Roadster is to beat gas sports cars on every performance metric by far, no exceptions, thus transferring the “halo crown” effect gas cars have as the top speed leaders over to pure electric."
2018-06-10,"That issue is better in latest Autopilot software rolling out now & fully fixed in August update as part of our long-awaited Tesla Version 9. To date, Autopilot resources have rightly focused entirely on safety. With V9, we will begin to enable full self-driving features."
2018-06-10,"This is why I’m not impressed when reporters who were literally in junior high while I was in newsrooms all round the world say that if I only knew how newsrooms really worked, then I’d know everything’s fine & no need for a media credibility rating system like Pravduh "
2018-06-10,"Zip2 also built a newspaper publishing platform that brought hundreds of regional & city papers online for the first time, and made major functionality advancements to the NY Times, Boston Globe & Knight-Ridder websites. NYT, KR & Hearst were all major investors in Zip2."
2018-06-10,20 years of intense programming on extremely weak CPUs with nothing for memory & a straw for bandwidth tends to burn itself onto your like a branding iron. Can still remember trying to squeeze fractions of a millisecond out of the /?€}%$&amp; fetch_joystick_state function.
2018-06-10,"In early 90s, I wrote a multitasker for PCs that spoofed the CPU & CD-ROM to act in parallel, so could read video continuously while player sprite moved smoothly. Required C++, assembly & direct flipping of CPU registers. That company’s name was Rocket Science. Fate loves irony."
2018-06-10,"That’s quite a blast from the past! After my Zip2 experience w patents, I felt that patents (particularly software) inhibited innovation, instead of fostering it. I aspired to file zero patents after that. In 2014, we open-sourced all Tesla patents"
2018-06-09,"At Zip2, I wrote entire V1 of software for drawing vector maps & calculating point to point directions anywhere in US (first ever company to do so), as well as white pages & business listings w reviews (an early Yelp). Also wrote V1 of classifieds, autotrading & real estate apps."
2018-06-09,"More background: I arrived in North America at 17 w $2000, a backpack & a suitcase full of books. Paid my own way thru college. Dropped out of Stanford Eng/Phys grad school w $110k in college debt. Created Internet startup w bro & Greg Khouri (love bro & loved Greg, may he RIP)"
2018-06-09,"We don’t think our product will be the cause of any wildfires, but The Boring Company is donating $10k."
2018-06-09,"Using the config you describe, plus an electric pump to replenish air in COPV, when car power draw drops below max pack power output, makes sense. But we are going to go a lot further."
2018-06-09,"19 years ago, when my 1st company got bought, I had to decide between buying a house in Palo Alto or a McLaren F1 (best car ever imo). Was no contest. I bought F1 & a small condo that was much cheaper than the car. New Tesla Roadster will exceed all gas sports cars in every way…"
2018-06-09,"SpaceX option package for new Tesla Roadster will include ~10 small rocket thrusters arranged seamlessly around car. These rocket engines dramatically improve acceleration, top speed, braking & cornering. Maybe they will even allow a Tesla to fly …"
2018-06-09,"Terms & conditions for “Not-a-Flamethrower” Please use as directed to avoid unintentionally burning things down. For simple & concise instructions, we drew upon wisdom in great Dr Seuss book “Green Eggs and Ham”. #ThrowFlamesResponsibly"
2018-06-09,"Almost forgot! Due to recent regulatory/customs rules enacted to inhibit transport of anything called a Flamethrower, we have renamed our product: “Not a Flamethrower”."
2018-06-09,Yes
2018-06-09,Each flamethrower comes with a state-of-the-art The Boring Company brand fire extinguisher. Will offer a TBC ice blaster before the dry season starts in winter.
2018-06-09,"Flamethrower obv best way to light your fireplace/BBQ. No more need to use a dainty “match” to ignite! If no wood, just drop your flamethrower in fire place! It will generate way more warmth than a quaint pile of logs."
2018-06-09,Coming soon
2018-06-09,I think so :)
2018-06-09,Nothing makes your baby more zen than a few gentle puffs of a TBC Flamethrower
2018-06-09,First 1000 Boring Company Flamethrowers being picked up today!
2018-06-08,We’re building out Tesla body repair in all major metro areas to ensure super fast & excellent outcome
2018-06-08,Talked with Tesla team. Looks like we can do the aluminum Model 3 pedal covers (slightly different from S). Turning on production for Model 3 Performance version.
2018-06-08,Gigafactory should be on 100% renewable energy (primarily solar with some wind) by next year. Rollout of solar already begun.
2018-06-08,"Yeah, actually closer to Skylab, but with 50% larger inner diameter"
2018-06-08,And we’re definitely going to have a pod bay door override button. Lesson learned.
2018-06-08,"Definitely. Will also have Augmented Mode that will massively enhance human driving ability. Like a flying metal suit, but in car form …"
2018-06-08,Running track in @SpaceX BF Spaceship will look something like this
2018-06-07,"No plans for aluminum pedals. Adds too much production complexity. Model 3 will def have summon, which will get way more advanced for S & X w HW2 Autopilot & all Model 3 cars."
2018-06-07,Working on improving
2018-06-07,"No way 6 mins is enough for abs. I mean, come on, 7 mins is obv right."
2018-06-07,"Oh please, that’s obv overkill"
2018-06-07,Tip of the day …
2018-06-06,Coming soon
