tweet,0,1
True ,0.0,1.0
Agreed. That’s approximately date when we expect Enhanced Summon to be in wide release. It will be magical. Lot of hard work by Autopilot team.,0.475,0.525
Fun party guaranteed!,0.0,1.0
Yup,0.5,0.5
And the lead character is also named Woody,0.12499594221717254,0.8750040577828274
i anime,0.0,1.0
Putting that on my LinkedIn for sure,0.4896091964572727,0.5103908035427274
Putting that on my LinkedIn for sure,0.4896091964572727,0.5103908035427274
Putting that on my LinkedIn for sure,0.4896091964572727,0.5103908035427274
"My apologies, am working on this exact issue right now",0.0,1.0
"My apologies, am working on this exact issue right now",0.0,1.0
Sure ,0.759020618556701,0.24097938144329895
"No, we’re building a BFR dev ship to do supersonic through landing tests in Boca Chica, Texas",0.9,0.1
Norway has already proven it could be done last month. No question Australia could do this in far fewer than 11 years.,0.0,1.0
Everyone who bought FSD will receive priority/early access,0.4896091964572727,0.5103908035427274
 Absolutely,0.5631147540983606,0.43688524590163935
"Yeah, it’s one of my favorite T-shirts!",0.6112058021615978,0.3887941978384021
Yup,0.0,1.0
 ,1.0,0.0
 ,1.0,0.0
Mad respect for the makers of things,0.6112058021615978,0.3887941978384021
Mad respect for the makers of things,0.6112058021615978,0.3887941978384021
Mad respect for the makers of things,0.6112058021615978,0.3887941978384021
Mad respect for the makers of things,0.6112058021615978,0.3887941978384021
Mad respect for the makers of things,0.6112058021615978,0.3887941978384021
"Building prototypes is relatively easy, volume production is hard",0.4,0.6
"Building prototypes is relatively easy, volume production is hard",0.4,0.6
"Building prototypes is relatively easy, volume production is hard",0.4,0.6
"We are still closing stores, just not as many as before. This basically splits the difference — about half as many stores closed, but then can afford only about half the price reduction. Was discussed with exec team & board.",1.0,0.0
Appears to be simulations all the way down …,0.7,0.3
Appears to be simulations all the way down …,0.7,0.3
"Get this question a lot, so need to clarify that there’s no such thing as a Tesla “refresh”. Other car companies do this every ~3 years, but Tesla constantly upgrades vehicle hardware every week.",0.9,0.1
"Get this question a lot, so need to clarify that there’s no such thing as a Tesla “refresh”. Other car companies do this every ~3 years, but Tesla constantly upgrades vehicle hardware every week.",0.9,0.1
"Get this question a lot, so need to clarify that there’s no such thing as a Tesla “refresh”. Other car companies do this every ~3 years, but Tesla constantly upgrades vehicle hardware every week.",0.9,0.1
"Get this question a lot, so need to clarify that there’s no such thing as a Tesla “refresh”. Other car companies do this every ~3 years, but Tesla constantly upgrades vehicle hardware every week.",0.9,0.1
"12,000 lbs!? How puny. Do you construct children’s toys?",0.1,0.9
Did it for the memes,0.3625,0.6375
Yes,0.0,1.0
 ,0.47962003454231433,0.5203799654576857
"End of Q4, most likely",0.8,0.2
What’s technology?,0.263939393939394,0.7360606060606061
What’s technology?,0.263939393939394,0.7360606060606061
We’re focusing on Boca right now for Starship & Cape is focused on Falcon/Dragon,0.6317216117216118,0.3682783882783882
We’re focusing on Boca right now for Starship & Cape is focused on Falcon/Dragon,0.6317216117216118,0.3682783882783882
Baby Thanos?,0.0,1.0
True,0.8,0.2
True,0.8,0.2
True,0.8,0.2
Hardest problem by far is building the production system of something this big. 2nd hardest is achieving full & rapid reuse with payload to orbit of ~2%.,0.4896091964572727,0.5103908035427274
It needed to be made real,0.6112058021615978,0.3887941978384021
"Oh stop teasing, Jeff ",0.6,0.4
"Direct drive using several Tesla Plaid motors in parallel for SN1. Simpler, lighter & more fault tolerant. Rear flaps each need ~1.5 megawatts. It’s like moving the entire wing of an aircraft!",0.0,1.0
Yes,0.4,0.6
Je ne regrette Etienne,0.1,0.9
"Could do it, but we developed low cost reusable tiles that are much lighter than transpiration cooling & quite robust",0.7,0.3
"Could do it, but we developed low cost reusable tiles that are much lighter than transpiration cooling & quite robust",0.7,0.3
This one is deep. Happy Thanksgiving!,0.4896091964572727,0.5103908035427274
Some good ideas here!,0.575,0.425
"Couple months, but V1.0 of Raptor Vac is suboptimal, as optimized for speed of development. Isp maybe 365 to 370 sec.",0.9606770833333333,0.039322916666666666
"Couple months, but V1.0 of Raptor Vac is suboptimal, as optimized for speed of development. Isp maybe 365 to 370 sec.",0.9606770833333333,0.039322916666666666
"Couple months, but V1.0 of Raptor Vac is suboptimal, as optimized for speed of development. Isp maybe 365 to 370 sec.",0.9606770833333333,0.039322916666666666
"No, will be autogenous from the start, tapping hot CH4 & O2 from Raptor",0.4,0.6
"No, will be autogenous from the start, tapping hot CH4 & O2 from Raptor",0.4,0.6
"No, will be autogenous from the start, tapping hot CH4 & O2 from Raptor",0.4,0.6
"No, will be autogenous from the start, tapping hot CH4 & O2 from Raptor",0.4,0.6
"Exactly. Still, pretty wild that the engine plume can climb up the side of a rocket going hypersonic speed!",0.6768176762058854,0.32318232379411466
Haha,0.6112058021615978,0.3887941978384021
Haha,0.6112058021615978,0.3887941978384021
"Storm Watch was active for hundreds of Powerwall customers this weekend as a result of @NWS Red Flag Fire Warnings in California, and we will continue to activate it whenever there advance awareness of a potential power outage or physical danger",1.0,0.0
"Seeing B pillar (diagonal fwd) & side repeater (diagonal back) camera views would probably help for tight situations. We can enable access to these views. Also, no problem to have option to disable auto lock for home.",0.12407097056251822,0.8759290294374817
Stop posting my password on twitter!,0.4221736596736597,0.5778263403263403
Tesla phone app release next week will enable service scheduling in 2 mins with a few taps. No more need to call!,0.8231147540983607,0.17688524590163937
Tesla phone app release next week will enable service scheduling in 2 mins with a few taps. No more need to call!,0.8231147540983607,0.17688524590163937
"Yes, signal acquired from that dish",0.9,0.1
"Yes, signal acquired from that dish",0.9,0.1
"Yes, signal acquired from that dish",0.9,0.1
"Yes, I do",0.0,1.0
Getting some regulatory pushback. May not be available in all regions.,0.7467697489818114,0.25323025101818863
Getting some regulatory pushback. May not be available in all regions.,0.7467697489818114,0.25323025101818863
"3 sea level optimized Raptors, 3 vacuum optimized Raptors (big nozzle)",0.7,0.3
 ,1.0,0.0
78% of people want to gentrify Mordor,0.0,1.0
 ,1.0,0.0
Worth watching Revenge of the Electric Car. Covers rebirth of electric cars in general. Has footage before & after we started production of our first car. https://m.youtube.com/watch?v=ru89x1jmpq4,0.3,0.7
"Opposite is true: you can have 100’s of layers of tunnels, but only one layer on surface (to first approximation), therefore trains should be on surface, cars below",1.0,0.0
"Opposite is true: you can have 100’s of layers of tunnels, but only one layer on surface (to first approximation), therefore trains should be on surface, cars below",1.0,0.0
"Yes, we will",0.5,0.5
"Yes, we will",0.5,0.5
A Shortfall of Gravitas,0.4896091964572727,0.5103908035427274
"Not true. Limiting factor in any staged combustion rocket engine, liquid/gas or gas/gas, is pressure & temperature in oxygen preburner",0.9,0.1
"Not true. Limiting factor in any staged combustion rocket engine, liquid/gas or gas/gas, is pressure & temperature in oxygen preburner",0.9,0.1
Almost three now. Boca team is crushing it! Starship has giant dome ,0.9,0.1
too Euro,0.324700703316557,0.675299296683443
too Euro,0.324700703316557,0.675299296683443
too Euro,0.324700703316557,0.675299296683443
"This is true. They each have avionics, several nitrogen thrusters & steerable parachutes.",0.0,1.0
True,0.30538641481762446,0.6946135851823756
Starship will do orbital launches from Boca Chica (near Brownsville) & Cape,0.4,0.6
"Most importantly, every electric car, Tesla or otherwise, matters to the environment we all share. Every time someone chooses electric, the future gets a little bit brighter! If not Tesla, please take a look at these other options: https://en.m.wikipedia.org/wiki/List_of_electric_cars_currently_available",0.8447364125660478,0.15526358743395216
"Most importantly, every electric car, Tesla or otherwise, matters to the environment we all share. Every time someone chooses electric, the future gets a little bit brighter! If not Tesla, please take a look at these other options: https://en.m.wikipedia.org/wiki/List_of_electric_cars_currently_available",0.8447364125660478,0.15526358743395216
"Most importantly, every electric car, Tesla or otherwise, matters to the environment we all share. Every time someone chooses electric, the future gets a little bit brighter! If not Tesla, please take a look at these other options: https://en.m.wikipedia.org/wiki/List_of_electric_cars_currently_available",0.8447364125660478,0.15526358743395216
"Most importantly, every electric car, Tesla or otherwise, matters to the environment we all share. Every time someone chooses electric, the future gets a little bit brighter! If not Tesla, please take a look at these other options: https://en.m.wikipedia.org/wiki/List_of_electric_cars_currently_available",0.8447364125660478,0.15526358743395216
!!,0.7777777777777778,0.22222222222222224
Not sure yet,0.8631147540983607,0.13688524590163936
Not sure yet,0.8631147540983607,0.13688524590163936
Not sure yet,0.8631147540983607,0.13688524590163936
"It will ultimately be used to make up for entire lost sections of the brain due to stroke/accident/congenital. Don’t want to get too excited, but the potential is truly transformational for restoring brain & motor functions. There is no other way to do it imo.",0.5258375195188933,0.47416248048110654
Making progress …,0.5631147540983606,0.43688524590163935
"We def could be wrong about this, but it’s actually good to fix high efficiency vacuum engines with giant nozzles in place & only thrust vector engines with smaller nozzles. Don’t need a lot of room & moment of inertia is much lower.",0.0,1.0
"We def could be wrong about this, but it’s actually good to fix high efficiency vacuum engines with giant nozzles in place & only thrust vector engines with smaller nozzles. Don’t need a lot of room & moment of inertia is much lower.",0.0,1.0
"We def could be wrong about this, but it’s actually good to fix high efficiency vacuum engines with giant nozzles in place & only thrust vector engines with smaller nozzles. Don’t need a lot of room & moment of inertia is much lower.",0.0,1.0
Is he ok?,0.8603723404255319,0.13962765957446807
Is he ok?,0.8603723404255319,0.13962765957446807
 ,0.06295336787564768,0.9370466321243522
Raptor just achieved power level needed for Starship & Super Heavy,0.6112058021615978,0.3887941978384021
nan,0.6112058021615978,0.3887941978384021
nan,0.6112058021615978,0.3887941978384021
nan,0.6112058021615978,0.3887941978384021
nan,0.6112058021615978,0.3887941978384021
Amazing work by Tesla China team!! ,0.8,0.2
"In close traffic, poisonous gas spewing from the car in front of you goes straight into your AC intake. Good thing gas/diesel carmakers didn’t cheat on their emissions or we’d be in real trouble ",0.0,1.0
Good question,0.0,1.0
"Raptor is evolving rapidly. Probably wouldn’t consider it to be even V1.0 until roughly engine 50, although probably engines 12+ can be retrofitted for orbital flight, especially on Super Heavy, which is less sensitive to engine variation. It just needs crazy up force!",0.0,1.0
"Aspirationally, they will be made to the exact same specification, but we can vary cell quantity to account for empirical variation",0.6112058021615978,0.3887941978384021
Definitely,0.7,0.3
"Gap in understanding is that $35k Model 3 production *starts* this month, but will not reach volume production until mid year. Extremely difficult to predict middle part of manufacturing S-curve.",0.2,0.8
"Gap in understanding is that $35k Model 3 production *starts* this month, but will not reach volume production until mid year. Extremely difficult to predict middle part of manufacturing S-curve.",0.2,0.8
"Gap in understanding is that $35k Model 3 production *starts* this month, but will not reach volume production until mid year. Extremely difficult to predict middle part of manufacturing S-curve.",0.2,0.8
"Gap in understanding is that $35k Model 3 production *starts* this month, but will not reach volume production until mid year. Extremely difficult to predict middle part of manufacturing S-curve.",0.2,0.8
Plug in a USB drive to record video,0.0,1.0
"Exactly. And you can on the moon, since it has no atmosphere.",0.39143804561451623,0.6085619543854838
"Exactly. And you can on the moon, since it has no atmosphere.",0.39143804561451623,0.6085619543854838
Took me an embarrassingly long time to learn that,0.2,0.8
Took me an embarrassingly long time to learn that,0.2,0.8
Took me an embarrassingly long time to learn that,0.2,0.8
Took me an embarrassingly long time to learn that,0.2,0.8
"The joints will have shielding, but it’s hard to ensure a good seal. Transpiration cooling (or simply higher pressure cold gas flow) would purge the area behind the hot gas seal.",0.8,0.2
Glad you’re all ok! ,0.06295336787564768,0.9370466321243522
We’ll let the NN loose on Track Mode one day … that’ll be insane,0.7,0.3
We are dramatically increasing Tesla Superchargers within cities & working with landlords to add home charging to apartment buildings,0.6112058021615978,0.3887941978384021
We are dramatically increasing Tesla Superchargers within cities & working with landlords to add home charging to apartment buildings,0.6112058021615978,0.3887941978384021
True,0.6112058021615978,0.3887941978384021
"Almost entirely C++, but we did have an (advanced for the time) client-side Java app for viewing maps & (weirdly) a 3D hockey game in VRML",0.7631147540983607,0.23688524590163934
"Almost entirely C++, but we did have an (advanced for the time) client-side Java app for viewing maps & (weirdly) a 3D hockey game in VRML",0.7631147540983607,0.23688524590163934
"I think will still be better than a normal roof, but adding a heating grid to automatically remove ice & snow sounds like a good option. We have that already on car windows!",0.5214516728901778,0.4785483271098222
Yes,0.6112058021615978,0.3887941978384021
Yes,0.6112058021615978,0.3887941978384021
Yes,0.6112058021615978,0.3887941978384021
Looking into it,0.2,0.8
Probably June 20,0.5,0.5
"Model 3 body design could def be less complex, but, yes, most of weight difference is due to higher safety vs other cars",0.0,1.0
It’s pretty much the only theory. This will mess with your mind: https://en.m.wikipedia.org/wiki/Probability_amplitude,0.39143804561451623,0.6085619543854838
"Six. Two windward, one under each fin & two leeward. Provides redundancy for landing on unimproved surfaces.",0.6,0.4
"Six. Two windward, one under each fin & two leeward. Provides redundancy for landing on unimproved surfaces.",0.6,0.4
"Six. Two windward, one under each fin & two leeward. Provides redundancy for landing on unimproved surfaces.",0.6,0.4
"Six. Two windward, one under each fin & two leeward. Provides redundancy for landing on unimproved surfaces.",0.6,0.4
7 to 10 years,0.0,1.0
Tesla Solarglass roof,0.6,0.4
Tesla Solarglass roof,0.6,0.4
Tesla Solarglass roof,0.6,0.4
Tesla Solarglass roof,0.6,0.4
Meaning not fair that Boeing gets so much more for the same thing,0.0,1.0
Yes Zorbix,0.324700703316557,0.675299296683443
Yes Zorbix,0.324700703316557,0.675299296683443
nan,0.324700703316557,0.675299296683443
"Sure, will aim to do this next week",0.1,0.9
Excellent meetings with senior leaders in China. Very thoughtful about the long-term future.,0.7629533678756477,0.23704663212435234
And even tinier ones for tardigrades,0.0,1.0
Dragon Crew Arm. Astronauts will walk this gantry to enter Dragon & depart for the @Space_Station.,0.2,0.8
No problem if you want to post the suggestions on this timeline. It’s great to get thoughtful criticism.,0.9,0.1
No problem if you want to post the suggestions on this timeline. It’s great to get thoughtful criticism.,0.9,0.1
"About right, but dangerously chuggy & risking bad things at 40%. We’ll keep it above 50% for this flight.",0.8,0.2
Nice,0.6,0.4
Nice,0.6,0.4
Thanks all Tesla club members for helping out! Looking forward to seeing you there tomorrow. ,0.0,1.0
Are you 100% certain that @businessinsider stands by @lopezlinette &amp; supports everything she’s done? Why won’t Lopez go on record saying that she never offered Tripp anything for inside info or asked him to break his confidentiality agreement by taking detailed video of Tesla IP?,0.75,0.25
"One day, there will be a little racing game in the racing game in the car",0.5140392893999706,0.48596071060002954
Only if they’re extremely tiny,1.0,0.0
Leasing now available for Model 3,0.7,0.3
"Due to some Tesla owners encountering system issues yesterday, the free Supercharging referral program will be extended until tomorrow night",0.0,1.0
"Gwynne rocks! Starlink will probably be a little bumpy at first, but then improve rapidly.",0.959020618556701,0.04097938144329897
"Gwynne rocks! Starlink will probably be a little bumpy at first, but then improve rapidly.",0.959020618556701,0.04097938144329897
(Credit @_TomCross_),0.4514782185401405,0.5485217814598595
Barrel on dome,0.4,0.6
Barrel on dome,0.4,0.6
"Actually, I stole it from my secret meme dealer #moneygang",0.24124542124542123,0.7587545787545789
Haha,0.0,1.0
Haha,0.0,1.0
For sure. It fundamentally improves quality of life.,0.16295336787564768,0.8370466321243523
How about being able to look through any of the cameras?,0.6112058021615978,0.3887941978384021
nan,0.41894329450107487,0.5810567054989251
nan,0.41894329450107487,0.5810567054989251
nan,0.41894329450107487,0.5810567054989251
We could probably do that,0.8618811881188119,0.1381188118811881
We could probably do that,0.8618811881188119,0.1381188118811881
"Most people aren’t aware that orbit (and “zero” gravity) is all about horizontal speed, not altitude. A spacecraft needs to travel about 25 times the speed of sound to stay in space.",0.8,0.2
"Most people aren’t aware that orbit (and “zero” gravity) is all about horizontal speed, not altitude. A spacecraft needs to travel about 25 times the speed of sound to stay in space.",0.8,0.2
"Most people aren’t aware that orbit (and “zero” gravity) is all about horizontal speed, not altitude. A spacecraft needs to travel about 25 times the speed of sound to stay in space.",0.8,0.2
"Most people aren’t aware that orbit (and “zero” gravity) is all about horizontal speed, not altitude. A spacecraft needs to travel about 25 times the speed of sound to stay in space.",0.8,0.2
For sure!,0.0,1.0
Excited to have Larry Ellison & Kathleen Wilson-Thompson join the Tesla board!,0.324700703316557,0.675299296683443
Excited to have Larry Ellison & Kathleen Wilson-Thompson join the Tesla board!,0.324700703316557,0.675299296683443
A 16 year old who has better reasoning & more heart than the vast majority of political leaders,0.27505050505050505,0.724949494949495
Good idea,0.2,0.8
Good idea,0.2,0.8
"Max thrust version of Raptor should achieve true T/W > 170. Target is 1.5 ton engine with >260 t-F. Max Isp version should achieve ~380 sec, but T/W probably <120 due to big nozzle. These are just guesses for now.",0.5,0.5
About to be upgraded to Chromium,0.2,0.8
Sure,0.5214516728901778,0.4785483271098222
Can’t wait to bring Tesla to Brazil. One of my favorite countries!,0.0,1.0
"Yeah, it might break",0.8,0.2
"Based on our data, Autopilot miles appear to be twice as safe as manually driven miles, and we expect this to improve further",0.5703723404255319,0.4296276595744681
Reminder to US buyers that the $7500 tax credit cuts in half in 5 days! Order online at http://Tesla.com to see if there is any inventory left in your region or visit Tesla stores.,0.5214516728901778,0.4785483271098222
Reminder to US buyers that the $7500 tax credit cuts in half in 5 days! Order online at http://Tesla.com to see if there is any inventory left in your region or visit Tesla stores.,0.5214516728901778,0.4785483271098222
Love the Concorde,0.6112058021615978,0.3887941978384021
I know that area well. Best would be to add ramps into the tunnel system from the basement levels of the parking lots surrounding 3rd St.,0.7,0.3
"Also, Tesla policy is that if you order a car without a test drive you get 3 days to return for full refund vs 1 day if you do get a test drive (resources are overbooked)",0.4,0.6
We don’t judge. Any pic you want!,0.48189603386480756,0.5181039661351925
We don’t judge. Any pic you want!,0.48189603386480756,0.5181039661351925
In the order that they were written,0.1,0.9
Edgy move,0.0636986301369863,0.9363013698630137
Already being done,1.0,0.0
The FSD upgrade is the Tesla computer with our NN chip,0.9,0.1
"Thanks, will consider next year",1.0,0.0
Shareholders could either to sell at 420 or hold shares & go private,0.7,0.3
Shareholders could either to sell at 420 or hold shares & go private,0.7,0.3
Shareholders could either to sell at 420 or hold shares & go private,0.7,0.3
Good question,0.9,0.1
Æsthetics,0.0,1.0
Æsthetics,0.0,1.0
Æsthetics,0.0,1.0
Almost ready. We expanded the early access program to 1000 more users a few days ago.,0.0,1.0
Ripley,0.4978463955026456,0.5021536044973545
Ripley,0.4978463955026456,0.5021536044973545
Ripley,0.4978463955026456,0.5021536044973545
Ripley,0.4978463955026456,0.5021536044973545
 this song is hard,0.5749206349206349,0.42507936507936506
That would great!,0.0,1.0
That would great!,0.0,1.0
That would great!,0.0,1.0
That would great!,0.0,1.0
I don’t have a controlling vote now & wouldn’t expect any shareholder to have one if we go private. I won’t be selling in either scenario.,0.1,0.9
I don’t have a controlling vote now & wouldn’t expect any shareholder to have one if we go private. I won’t be selling in either scenario.,0.1,0.9
This require hardware,0.9,0.1
"Good question. NHTSA is great for fundamental structural safety, except for unbelted front passenger occupant factor. Very rare these days for front passenger to be unbelted. NCAP also great, but there are some weird headlight angle factors. Super inside baseball stuff …",0.6112058021615978,0.3887941978384021
Spaceballs,0.2,0.8
High time we had a Tesla coil!,0.5766117406691808,0.42338825933081925
My hope is *all* current investors remain with Tesla even if we’re private. Would create special purpose fund enabling anyone to stay with Tesla. Already do this with Fidelity’s SpaceX investment.,0.0,1.0
My hope is *all* current investors remain with Tesla even if we’re private. Would create special purpose fund enabling anyone to stay with Tesla. Already do this with Fidelity’s SpaceX investment.,0.0,1.0
My hope is *all* current investors remain with Tesla even if we’re private. Would create special purpose fund enabling anyone to stay with Tesla. Already do this with Fidelity’s SpaceX investment.,0.0,1.0
My hope is *all* current investors remain with Tesla even if we’re private. Would create special purpose fund enabling anyone to stay with Tesla. Already do this with Fidelity’s SpaceX investment.,0.0,1.0
Physics can be thought of as the compression algorithms of reality,0.4896091964572727,0.5103908035427274
Somewhere between 500% & 2000%,0.5111111111111111,0.48888888888888893
Somewhere between 500% & 2000%,0.5111111111111111,0.48888888888888893
We’re doomed!,0.0,1.0
We’re doomed!,0.0,1.0
"Tesla is building a major engineering team in China, incl heavy focus on software/firmware for factory & car",0.6112058021615978,0.3887941978384021
"About 10 orbit synch windows, which are every 26 months, so self-sufficiency around 2050",0.4896091964572727,0.5103908035427274
"In recent years, hours were much higher. Don’t recommend though — bad for health & happiness. But no choice or Tesla would die. Hope to reduce to 80 hours next year.",0.4,0.6
"In recent years, hours were much higher. Don’t recommend though — bad for health & happiness. But no choice or Tesla would die. Hope to reduce to 80 hours next year.",0.4,0.6
Coming hopefully later this year,0.7590529247910863,0.24094707520891365
"Thanks John, really admire you too! I think you’re one of the best engineers ever. Hope you return to working on rockets one day.",0.8447364125660478,0.15526358743395216
Ok,0.6309956297572396,0.36900437024276034
"Full year production is usually ~70% of peak daily rate, so 500/year. Still, non-trivial at 100,000 tons of thrust/year.",0.7,0.3
"Yeah, system should adapt to most likely destination & anticipate school, then work, if that’s owner preference",0.2,0.8
Yes,0.7591673893313394,0.24083261066866052
Click checkbox under “Advanced Settings”,0.4896091964572727,0.5103908035427274
Click checkbox under “Advanced Settings”,0.4896091964572727,0.5103908035427274
Click checkbox under “Advanced Settings”,0.4896091964572727,0.5103908035427274
True,0.9,0.1
True,0.9,0.1
True,0.9,0.1
"Yeah, we just finished two more propellant domes. SpaceX team & supporting suppliers are doing amazing work ramping Starship production.",0.8621693121693121,0.13783068783068783
 Tesla China Team Such amazing progress!!,0.7,0.3
 Tesla China Team Such amazing progress!!,0.7,0.3
 Tesla China Team Such amazing progress!!,0.7,0.3
