tweet,0,1
Am considering taking Tesla private at $420. Funding secured.,0.6,0.4
"We’re working on a simple initial version of Autopark. Will be safe, but sometimes park in silly places that aren’t actual parking spaces.",0.6112058021615978,0.3887941978384021
"We’re working on a simple initial version of Autopark. Will be safe, but sometimes park in silly places that aren’t actual parking spaces.",0.6112058021615978,0.3887941978384021
"We’re working on a simple initial version of Autopark. Will be safe, but sometimes park in silly places that aren’t actual parking spaces.",0.6112058021615978,0.3887941978384021
Yes,0.8099999999999999,0.19
Yes,0.8099999999999999,0.19
"Falcon fairing halves missed the net, but touched down softly in the water. Mr Steven is picking them up. Plan is to dry them out & launch again. Nothing wrong with a little swim.",0.0,1.0
"Varies per person, but about 80 sustained, peaking above 100 at times. Pain level increases exponentially above 80.",1.0,0.0
"Varies per person, but about 80 sustained, peaking above 100 at times. Pain level increases exponentially above 80.",1.0,0.0
Going offline for a few days,0.0,1.0
7,0.9,0.1
I’d be way too embarrassed to put that on a Tesla. It’s like a kid’s drawing.,0.31,0.6900000000000001
True,0.15905292479108635,0.8409470752089137
This reaction has shaken my opinion of many people. We were asked to create a backup option & worked hard to do so. Checked with dive team many times to confirm it was worthwhile. Now it’s there for anyone who needs it in future. Something’s messed up if this is not a good thing.,0.0,1.0
Looking forward to seeing Giga Shanghai soon Amazing work by Tesla China team &amp; support of authorities much appreciated!,0.7117142611024703,0.2882857388975298
"Yeah, good idea to offer that as a setting",0.8117142611024702,0.18828573889752978
Haha,0.0,1.0
"People sometimes forget that a company is just a group of people gathered together to make products. So long as it makes great products, it will have great value.",0.2,0.8
"People sometimes forget that a company is just a group of people gathered together to make products. So long as it makes great products, it will have great value.",0.2,0.8
Coming …,0.36067708333333337,0.6393229166666667
Coming …,0.36067708333333337,0.6393229166666667
"Yeah, gimbal SL engines at min throttle for control, so most of impulse goes through vac engines",0.0,1.0
So … how was your night?,0.9,0.1
The goodwill of the public is critical to Starship’s success,1.0,0.0
"Whether you plan to buy a Dual Motor Performance Model 3 or not, take it for a test drive anyway. It’s like having pure fun jacked straight into your brain whenever you want.",0.0,1.0
"On Mars, I like to drink my coffee in this mug",0.4896091964572727,0.5103908035427274
"I think so. For sure worth giving it our best shot! Would be great to have a competitive, commercial program to build a moon base that is outcome-oriented (not cost-plus), so you only get paid for safe delivery of cargo.",0.6631147540983606,0.3368852459016393
"Yes, I am a little girl. Ok, not that little. Or a girl.",0.8407142857142856,0.15928571428571425
True,0.0,1.0
"We’ll tweak the alloy over time, so it won’t exactly be 301, but close",0.0,1.0
"No matter how many times u get hangry, you always think ur anger is real — Plato",0.0,1.0
"No matter how many times u get hangry, you always think ur anger is real — Plato",0.0,1.0
"No matter how many times u get hangry, you always think ur anger is real — Plato",0.0,1.0
Absolutely. You’ve touched on a very important point. The ship must be easy to repair on the moon and Mars.,0.959020618556701,0.04097938144329897
Late night tweets … sigh,0.7,0.3
nan,0.42108225108225106,0.5789177489177489
"Hopefully, in March. Checking …",0.0,1.0
"Rest in peace, Stan Lee. The many worlds of imagination & delight you created for humanity will last forever.",0.1,0.9
"Rest in peace, Stan Lee. The many worlds of imagination & delight you created for humanity will last forever.",0.1,0.9
Yes,0.0,1.0
Will be on @JoeRogan at 9:30pm Pacific on Thursday,0.8,0.2
"Exactly. Also, you can’t actually use computation from a separate GPU effectively, as you get choked on the bus, so most of the computation is irrelevant. High power, high cooling, but low true, usable TOPS. Worst of all worlds.",0.0,1.0
"Homes with solar sell for 4.1% more, according to Zillow. Adding a Powerwall battery is highly likely to increase home value too imo, as security against blackouts is increasingly important. https://www.zillow.com/research/solar-panels-house-sell-more-23798/amp/?__twitter_impression=true",0.6317216117216118,0.3682783882783882
Great list of hotel hacks in this thread!,0.2,0.8
"Failure rate is actually both higher & lower than that, as the Falcon 9 design has changed almost completely several times. Currently flying version has no failures (may fate continue to be merciful), but older versions therefore have a higher failure rate.",0.9582655826558266,0.04173441734417344
Been wanting to go ever since that Finnish metal band won https://m.youtube.com/watch?v=gAh9NRGNhUU,0.3487878787878788,0.6512121212121212
Been wanting to go ever since that Finnish metal band won https://m.youtube.com/watch?v=gAh9NRGNhUU,0.3487878787878788,0.6512121212121212
Haha,0.0,1.0
"Thanks! Yeah, that’s pretty close.",0.9,0.1
Fire and Ice,0.5,0.5
Fire and Ice,0.5,0.5
Teslaquila coming soon …,0.4896091964572727,0.5103908035427274
Honored to work with amazing teams at SpaceX & Tesla!,0.3,0.7
Jim Cramer explains short-seller market manipulation https://en.m.wikipedia.org/wiki/Jim_Cramer#Market_manipulation,0.2,0.8
"To be precise, r is distance from center of masses of two objects. Center of mass of Earth is ~6400km, so gravity change is small at Space Station altitude, which is ~6800km from center of Earth.",0.0,1.0
"To be precise, r is distance from center of masses of two objects. Center of mass of Earth is ~6400km, so gravity change is small at Space Station altitude, which is ~6800km from center of Earth.",0.0,1.0
"To be precise, r is distance from center of masses of two objects. Center of mass of Earth is ~6400km, so gravity change is small at Space Station altitude, which is ~6800km from center of Earth.",0.0,1.0
Software upgrade to rain sensing neural net coming next month,0.1,0.9
Just leaving SpaceX Starship build site in Boca,0.6,0.4
"There is no rational basis for a long holder to lend their stock to shorts, as it dilutes the shareholder base & gives the short a strong incentive to attack the company by whatever means possible, including regulators",0.0,1.0
"I def believe in the ethical treatment of animals & taking action of climate, but these are mostly separate moral issues",0.8629533678756477,0.13704663212435234
"I def believe in the ethical treatment of animals & taking action of climate, but these are mostly separate moral issues",0.8629533678756477,0.13704663212435234
Changing Tesla horn sound to ,0.660372340425532,0.33962765957446805
"If advanced AI (beyond basic bots) hasn’t been applied to manipulate social media, it won’t be long before it is",0.1,0.9
"If advanced AI (beyond basic bots) hasn’t been applied to manipulate social media, it won’t be long before it is",0.1,0.9
Thin tiles on windward side of ship & nothing on leeward or anywhere on booster looks like lightest option,0.6112058021615978,0.3887941978384021
Probably Starlink &amp; some fun things,0.0,1.0
"Moreover, based on extensive cave video review & discussion with several divers who know journey, SpaceX engineering is absolutely certain that mini-sub can do entire journey & demonstrate at any time.",0.9590529247910864,0.04094707520891365
Aiming for hover test next week,0.6112058021615978,0.3887941978384021
Same goes for all countries within which we officially operate by end of next year,0.6112058021615978,0.3887941978384021
Same goes for all countries within which we officially operate by end of next year,0.6112058021615978,0.3887941978384021
Where’s Flextape when you need it!?,0.6606770833333334,0.3393229166666667
Where’s Flextape when you need it!?,0.6606770833333334,0.3393229166666667
"Yes, but we want to focus on textured black first, then move into Earth tones & convolutions",0.8447364125660478,0.15526358743395216
"Yes, but we want to focus on textured black first, then move into Earth tones & convolutions",0.8447364125660478,0.15526358743395216
"Definitely. All major highways in Texas will have Superchargers, all the way to Brownsville & across Mexico.",0.1,0.9
"Definitely. All major highways in Texas will have Superchargers, all the way to Brownsville & across Mexico.",0.1,0.9
"Definitely. All major highways in Texas will have Superchargers, all the way to Brownsville & across Mexico.",0.1,0.9
"Definitely. All major highways in Texas will have Superchargers, all the way to Brownsville & across Mexico.",0.1,0.9
"Definitely. All major highways in Texas will have Superchargers, all the way to Brownsville & across Mexico.",0.1,0.9
"All 60 Starlink satellites online, solar array deployment coming up soon",0.0,1.0
"All 60 Starlink satellites online, solar array deployment coming up soon",0.0,1.0
"All 60 Starlink satellites online, solar array deployment coming up soon",0.0,1.0
Mein Herz brennt is boss fight song,0.7,0.3
Cost of Tesla full self-driving option increasing by ~$1000 on August 16,0.8,0.2
First point release update expected to go out this weekend,0.9,0.1
"That’s correct. Essentially controlled falling, like a skydiver.",0.7,0.3
Govt has been unwelcome,0.324700703316557,0.675299296683443
"Yes. Supercharger coverage will extend to 100% of Europe next year. From Ireland to Kiev, from Norway to Turkey.",0.0,1.0
"More carrot, less stick",0.4191053391053391,0.5808946608946608
"The profound impact of high bandwidth, high precision neural interfaces is underappreciated. Neuralink may have this in a human as soon as this year. Just needs to be unequivocally better than Utah Array, which is already in some humans & has severe drawbacks.",0.5,0.5
"The profound impact of high bandwidth, high precision neural interfaces is underappreciated. Neuralink may have this in a human as soon as this year. Just needs to be unequivocally better than Utah Array, which is already in some humans & has severe drawbacks.",0.5,0.5
Sorry Had a vital mission in Norway Now I am back,0.7,0.3
"Market was bit high anyway, so due for a correction",0.4314285714285714,0.5685714285714285
Haha true,0.1,0.9
Only thing almost anyone would notice is the nose,1.0,0.0
Only thing almost anyone would notice is the nose,1.0,0.0
Yep,0.5,0.5
Yep,0.5,0.5
Yes,0.18266233766233766,0.8173376623376623
3 guys standing on roof of skyscraper. 1st guy says updraft is so strong it blows you back on roof of you jump off. He jumps off & is blown back on roof. 2nd guy tries & goes splat. 3rd guy: that was a dirty trick Superman.,0.9,0.1
Very interesting,0.9,0.1
It’s a bit slow,0.0,1.0
It’s a bit slow,0.0,1.0
It certainly does,0.1,0.9
"Avg speed of NY Subway is actually 17mph. TBC loop can run at 155mph with 16 pax autopods passing every second, routing automatically between tunnels to their destination. That’s 57,600/hour/lane & you can build dozens of lanes. Will crush any subway in throughput & convenience.",0.058265582655826556,0.9417344173441734
"Avg speed of NY Subway is actually 17mph. TBC loop can run at 155mph with 16 pax autopods passing every second, routing automatically between tunnels to their destination. That’s 57,600/hour/lane & you can build dozens of lanes. Will crush any subway in throughput & convenience.",0.058265582655826556,0.9417344173441734
"Avg speed of NY Subway is actually 17mph. TBC loop can run at 155mph with 16 pax autopods passing every second, routing automatically between tunnels to their destination. That’s 57,600/hour/lane & you can build dozens of lanes. Will crush any subway in throughput & convenience.",0.058265582655826556,0.9417344173441734
Exactly!,0.6112058021615978,0.3887941978384021
Am basically doing continuous AMA on Twitter!,0.0,1.0
Fundamental advantage of layers of tunnels is you can have as many lanes as you want going in any direction. Will feel like folding space from one part of a city to another.,0.6112058021615978,0.3887941978384021
Fundamental advantage of layers of tunnels is you can have as many lanes as you want going in any direction. Will feel like folding space from one part of a city to another.,0.6112058021615978,0.3887941978384021
Battle Angel Starship,0.5815622711515451,0.41843772884845487
Tesla owners can refer someone to buy a Tesla & get any image they want laser etched in glass & sent to deep space for millions of years,0.27142857142857146,0.7285714285714285
Tesla owners can refer someone to buy a Tesla & get any image they want laser etched in glass & sent to deep space for millions of years,0.27142857142857146,0.7285714285714285
"Production version will be a lot more polished than this prototype, but still fun to see",0.4896091964572727,0.5103908035427274
This is why we put extra filters in all Tesla cars. S & X even have hospital operating room grade HEPA filters.,0.0,1.0
This is why we put extra filters in all Tesla cars. S & X even have hospital operating room grade HEPA filters.,0.0,1.0
This is why we put extra filters in all Tesla cars. S & X even have hospital operating room grade HEPA filters.,0.0,1.0
Boring product launch will be streamed live at 8pm California time tonight,0.1,0.9
Ah yes fair point,0.45905292479108634,0.5409470752089136
Ah yes fair point,0.45905292479108634,0.5409470752089136
"Almost everything is different. These parts are stamped vs manually bump-formed & TIP TIG welded vs flux core. Higher precision, stronger joints & 20% mass reduction.",0.25826558265582655,0.7417344173441734
"Almost everything is different. These parts are stamped vs manually bump-formed & TIP TIG welded vs flux core. Higher precision, stronger joints & 20% mass reduction.",0.25826558265582655,0.7417344173441734
Not yet,0.7,0.3
They have the best merkins,0.8,0.2
Actually true,0.1,0.9
Krypton ion thrusters activate in about 3 hours to raise orbit,0.5214516728901778,0.4785483271098222
Krypton ion thrusters activate in about 3 hours to raise orbit,0.5214516728901778,0.4785483271098222
Krypton ion thrusters activate in about 3 hours to raise orbit,0.5214516728901778,0.4785483271098222
Ok,0.2,0.8
Ok,0.2,0.8
Ok,0.2,0.8
California,0.704047619047619,0.2959523809523809
California,0.704047619047619,0.2959523809523809
"Also, cars are called “automobiles”",0.0,1.0
"Also, cars are called “automobiles”",0.0,1.0
"Cool! Actually, if you buy a Tesla without a test drive, you have 3 days to return it. If you buy after a test drive, you still have 24 hours. Trying to incent buying with no test drive.",0.6112058021615978,0.3887941978384021
"Used to live in Silicon Valley, now I live in Silicone Valley",0.9,0.1
"Used to live in Silicon Valley, now I live in Silicone Valley",0.9,0.1
"Used to live in Silicon Valley, now I live in Silicone Valley",0.9,0.1
nan,0.6112058021615978,0.3887941978384021
Coming soon,1.0,0.0
8th hottest song on Soundcloud!! https://m.soundcloud.com/user-209448905/dont-doubt-ur-vibe,0.7,0.3
8th hottest song on Soundcloud!! https://m.soundcloud.com/user-209448905/dont-doubt-ur-vibe,0.7,0.3
8th hottest song on Soundcloud!! https://m.soundcloud.com/user-209448905/dont-doubt-ur-vibe,0.7,0.3
Working on it,0.0,1.0
Working on it,0.0,1.0
Working on it,0.0,1.0
 ,0.1,0.9
"Mostly accurate, even though I didn’t do an interview (or pose for cover)",0.6309956297572396,0.36900437024276034
"Super fun software Easter eggs coming to all Tesla S/3/X cars before the holidays! Romance mode, toilet humor & more video games.",0.2,0.8
"Intuitively, that should be straightforward to address, but there could be complexities I’m unaware of",0.4,0.6
"This is in addition to existing Cabin Overheat Protection, which come on automatically at high temps to ensure any babies or pets in the car are safe",0.2,0.8
Haha awesome,0.0,1.0
Yup,0.4896091964572727,0.5103908035427274
Yup,0.4896091964572727,0.5103908035427274
Defeating traffic is the ultimate boss battle,0.0,1.0
Your comment above: “Who in their right mind would buy an ICE after 2025 knowing its residual value will be zilch? Legacy auto: go EV or go BUST!” is super important for car buyers. Residual values for gas/diesel cars will plummet in coming years.,0.0,1.0
Your comment above: “Who in their right mind would buy an ICE after 2025 knowing its residual value will be zilch? Legacy auto: go EV or go BUST!” is super important for car buyers. Residual values for gas/diesel cars will plummet in coming years.,0.0,1.0
"We had to reallocate some resources to speed this up & received great support from Airborne, our parachute supplier. I was at their Irvine factory with the SpaceX team on Sat and Sun. We’re focusing on the advanced Mk3 chute, which provides highest safety factor for astronauts.",0.5140392893999706,0.48596071060002954
Drone cam,0.0,1.0
Haha true,0.7466666666666666,0.2533333333333333
Haha true,0.7466666666666666,0.2533333333333333
Haha true,0.7466666666666666,0.2533333333333333
Twitter thought I got hacked & locked my account haha,0.24124542124542123,0.7587545787545789
"The Super Heavy booster is only needed on Earth, so think of this as just “Starship” & sometimes it needs a boost, hence Super Heavy",0.4,0.6
Love that movie!,0.625,0.375
Yes ,0.8871857246608789,0.11281427533912114
I am become meme,0.8188924852237547,0.18110751477624545
So cool,0.13999999999999999,0.86
"Yeah, just use a dryer outlet. High power, easy to install & low cost.",0.8407142857142856,0.15928571428571425
"To be clear, actual NN improvement is significantly overestimated in this article. V9.0 vs V8.1 is more like a ~400% increase in useful ops/sec due to enabling integrated GPU & better use of discrete GPU.",0.2,0.8
To carry 7 people,1.0,0.0
Yes,0.0,1.0
And that’s just the tip of the iceberg,0.2,0.8
And that’s just the tip of the iceberg,0.2,0.8
And that’s just the tip of the iceberg,0.2,0.8
4000 Tesla cars loading in SF for Europe,0.2545454545454545,0.7454545454545454
Always,0.9,0.1
Will be interesting to see how this evolves over time,0.7851190476190476,0.21488095238095237
Am talking to @FAA in a few hours,0.7962172154039383,0.20378278459606167
Probably technically able to do so in about a year. Then up to regulators.,0.0,1.0
"This is completely backwards. Based on what we’ve learned from the Hawthorne test tunnel, we’re moving forward with a much larger tunnel network under LA. Won’t need a second test tunnel under Sepulveda.",0.7,0.3
"It can, but the attachment fixtures are different from standard F9 & they weren’t ready in time",0.06295336787564768,0.9370466321243522
"Great, thanks",0.2,0.8
"Exactly! It’s also a far more exciting & inspiring future if consciousness is out there among the stars, than forever confined to Earth until some eventual extinction event, however far in the future that may be (hopefully, very far).",0.76,0.24
 ,0.4,0.6
Ok,0.7425582714521453,0.2574417285478548
Never heard of it,0.0,1.0
"Fixing several minor bugs & a regression in highway driving, so probably early to mid next week",0.7669782871849053,0.23302171281509465
The @Space_Station is moving at ~25 times the speed of sound &amp; orbits the Earth every 90 minutes,0.0,1.0
Should be done with first orbital prototype around June,0.0,1.0
No,0.7,0.3
New emoji! Last one comes with free phone hack.,0.324700703316557,0.675299296683443
"Sorry, Drag Times is correct, Top Gear is wrong",0.960372340425532,0.03962765957446808
"Same facts, same period of time, but extremely different reporting",0.7,0.3
"Same facts, same period of time, but extremely different reporting",0.7,0.3
"Same facts, same period of time, but extremely different reporting",0.7,0.3
"Same facts, same period of time, but extremely different reporting",0.7,0.3
Tomorrow brings a lemur,0.0,1.0
Why did @lopezlinette publish a love letter puff piece about Chanos’s cuff links? Who took the pic? Obv not objective,0.7,0.3
Some secrets are too dangerous to be free,0.06311475409836066,0.9368852459016394
"The LA Times has a long track of unreasonable attacks on SpaceX & Tesla, but in this case it was our miscommunication",0.324700703316557,0.675299296683443
http://Etymology.com,0.2,0.8
The answer is always aliens,0.0,1.0
Liquid oxygen,0.8,0.2
"Shanghai Giga will produce affordable versions of 3/Y for greater China. All Model S/X & higher cost versions of Model 3/Y will still be built in US for WW market, incl China.",0.0,1.0
"Shanghai Giga will produce affordable versions of 3/Y for greater China. All Model S/X & higher cost versions of Model 3/Y will still be built in US for WW market, incl China.",0.0,1.0
Entropy is the ultimate boss battle,0.7382203141224257,0.26177968587757416
DMT FTW,0.9249322493224932,0.07506775067750678
No,0.0,1.0
"There are way easier places to work, but nobody ever changed the world on 40 hours a week",0.0,1.0
"There are way easier places to work, but nobody ever changed the world on 40 hours a week",0.0,1.0
"There are way easier places to work, but nobody ever changed the world on 40 hours a week",0.0,1.0
I think real,0.0,1.0
крипто,0.7,0.3
Because it costs $2500 to transport to east coast & everyone pays same,0.3,0.7
Because it costs $2500 to transport to east coast & everyone pays same,0.3,0.7
My chariot license is made of papyrus!,0.4,0.6
My chariot license is made of papyrus!,0.4,0.6
That would be cool to do one day,0.9,0.1
Which seems to be the approximate pixel size of reality,0.0,1.0
"Earth’s crust is only ~1% of Earth mass, so technically we should be called Lava",0.0,1.0
nan,0.6,0.4
Haha exactly,0.7590529247910863,0.24094707520891365
Exactly,0.9,0.1
The Cape is one of the two Starship build sites. More on this later.,0.9,0.1
Not moths tho,0.6,0.4
"Hoping to open in Slovakia, Croatia, Serbia & most of Eastern Europe early next year. Finally, we will do Nikola Tesla proud by having his cars in his countries of origin!",0.0,1.0
This is incorrect. No air suspension planned for 3/Y. Only S/X & Cybertruck have/will have air suspension.,0.0,1.0
This is incorrect. No air suspension planned for 3/Y. Only S/X & Cybertruck have/will have air suspension.,0.0,1.0
This is incorrect. No air suspension planned for 3/Y. Only S/X & Cybertruck have/will have air suspension.,0.0,1.0
"For other countries, we pay in part for the local factory by selling cars there ahead of time. Also, gives a sense of demand. Current rules in India prevent that, but recent changes in sales tax give hope for future changes.",0.45905292479108634,0.5409470752089136
Opening event that night & free rides for the public next day,0.4,0.6
Yes,0.0,1.0
"No, but very close",0.1,0.9
Tesla comms is fixing. That was a mistake.,0.41894329450107487,0.5810567054989251
 in ,0.0,1.0
Warms my ,0.1,0.9
Nobody *expects* the Cybertruck,0.0,1.0
Me too,0.6112058021615978,0.3887941978384021
Oh hi guys … lol https://www-m.cnn.com/2018/11/06/health/oumuamua-alien-probe-harvard-intl/index.html?r=https%3A%2F%2Fwww.google.com%2F,0.21444444444444444,0.7855555555555556
"For those worried about running out of fresh water, it may help to know that desalination only costs 0.1 cents per liter or half a cent per gallon",1.0,0.0
"For those worried about running out of fresh water, it may help to know that desalination only costs 0.1 cents per liter or half a cent per gallon",1.0,0.0
REALiTi made while u wait,0.7,0.3
REALiTi made while u wait,0.7,0.3
REALiTi made while u wait,0.7,0.3
True (sigh),1.0,0.0
Wow,0.5491836475246086,0.45081635247539137
"Warning, this presentation is 4 hrs & 20 mins long",0.8777777777777779,0.12222222222222223
"Tesla is first American car company to achieve sustained volume production in past ~100 years. Hardest, most painful thing I’ve ever been through, including getting Falcon to orbit.",0.4896091964572727,0.5103908035427274
"Tesla rear wheel drive cars do actually work well on snow & ice. We did our traction testing on an ice lake! Dual motor AWD is great, but not required for cold weather. Just don’t use sport/summer tires.",0.3,0.7
155 mph | 250 km/h,0.685921735893925,0.3140782641060749
 be still my beating heart ,0.3,0.7
"No, it’s along the way",0.0,1.0
"Wow, it’s been 5 years since we started at Boca!",0.0,1.0
"Wow, it’s been 5 years since we started at Boca!",0.0,1.0
"You’re right. We did have a sim ready, but it was confusing, so I didn’t include it. We’re working on one that makes things clear.",0.42108225108225106,0.5789177489177489
Three quarks for Muster Mark!,0.9,0.1
Three quarks for Muster Mark!,0.9,0.1
"Couldn’t afford to pay for repairs, so I fixed almost everything on that car from parts in the junkyard. Ironically, that’s me replacing broken side window glass. The circle is complete lol.",0.0,1.0
I’m told it’s looking positive & we will be allowed to continue servicing our cars in Texas,1.0,0.0
"Also, I hate deeply nested classes in C++. Had to be said.",0.4621693121693122,0.5378306878306878
"Also, I hate deeply nested classes in C++. Had to be said.",0.4621693121693122,0.5378306878306878
"Also, I hate deeply nested classes in C++. Had to be said.",0.4621693121693122,0.5378306878306878
"Also, I hate deeply nested classes in C++. Had to be said.",0.4621693121693122,0.5378306878306878
"This product may appear simple, but actually *very* difficult to get right",0.7,0.3
N2 for vacuum. Aero surfaces & high gimbal angle main engines for atmosphere.,0.1,0.9
Machines that go “ping”,0.4896091964572727,0.5103908035427274
Machines that go “ping”,0.4896091964572727,0.5103908035427274
Close,0.9,0.1
"This includes original engineering of new factory processes & cars. Great engineers will only join if original engineering is supported, not just localization.",0.0,1.0
